2009,纸塑复合包装材料UV墨光引发剂迁移试验与理论研究--《江南大学》,迁移 光引发剂 纸塑复合材料 迁移模型 稳定性 UV墨 食品安全,紫外光Ultraviolet简称UV固化墨以其本身的优异特性被广泛用于食品包装印刷虽然它不存在溶剂挥发问题但是所用的低分子量光引发剂具有一定毒性对皮肤有一定的刺激性而且容易挥发和迁移给被包装食品带来难闻气味甚至毒性对人体健康是一种威胁论文就纸塑复合包装材料纸中助剂及光引发剂的检测技术光引发剂迁移试验及理论迁移预测模型的建立进行了系统性的研究主要内容包括以下几个方面1GCFIDgaschromatographyflameionizationdetection气相色谱氢火焰离子化检测器检测方法的确立研究确定UV墨中光引发剂α羟基环己基苯基甲酮184和22二甲氧基苯基甲酮651标准品GCFID检测条件研究确定纸塑复合包装材料纸中助剂光引发剂184和651的GCFID检测条件HP5毛细管柱检测器温度250进样口温度250不分流进样进样量1μL载气为氮气升温程序初始温度100以5min升至200保持2min再以35min升至300保持5min2UV墨光引发剂稳定性试验研究试验研究了2040和60温度条件下184和651在1095乙醇水溶液和异辛烷中的避光稳定性同时考察了光稳定剂对羟基苯甲醚HQMME的加入在避光条件下对稳定性的影响结果表明避光条件下光稳定剂对184和651的稳定性影响不显著除60温度条件下651在10乙醇水溶液中存在不稳定外其它条件下184和651都是稳定的利用GCMS对651的分解产物进行了定性分析3纸塑复合包装材料纸中光引发剂的迁移试验研究试验研究了2040和60温度条件下纸塑复合材料40156515中184和651向1095乙醇和异辛烷的迁移材料4025中184和651向10乙醇和异辛烷的迁移材料3312中184和651向95乙醇和异辛烷的迁移结果表明同一污染物向同一食品模拟物的迁移受温度影响显著在同样的试验条件下分子量大的651的迁移速率低于分子量小的184的迁移速率同一污染物在同一试验温度下向异辛烷中的迁移速度最快向10乙醇水溶液中的迁移速度最慢随着低密度聚乙烯lowdensitypolyethyleneLDPE淋膜量的加大迁移量明显减少聚丙烯polypropylenePP的阻隔特性优于LDPE的阻隔特性同种试验条件下松厚度大的纸中污染物的迁移速度相对较快迁移量随污染物初始浓度的增大明显增大文中还从微观角度分析了温度污染物分子结构食品模拟物的溶胀淋膜层厚度淋膜层种类和纸张性质对迁移的影响4迁移预测模型的建立建立了无限厚纸层迁移预测模型和有限厚纸层迁移预测模型模型分别将纸的厚度作为无限厚相对于塑料涂层厚度和有限厚进行考虑包装食品体系作为有限包装无限食品进行研究模型引入新的参量纸和塑料界面处的分配系数kCP考虑了污染物在纸和塑料涂层中不同的扩散系数DPDC最终给出扩散方程初始条件和边界条件用拉普拉斯和反拉普拉斯变换对方程求一系列解析解并分析了各参量kCPDPDC和纸中污染物初始浓度CP0等对迁移行为的影响5有限厚纸层迁移预测模型通用性及与实验值的对比分析讨论了有限厚纸层迁移预测模型简化后作为双层复合塑料和单层塑料中污染物向食品中迁移的预测模型通用性简化的双层塑料预测模型表达式最终与著名的LaoubiVergnaud模型一致简化的单层塑料预测模型最终为著名的Crank迁移扩散表达式根据试验测定的纸塑界面处分配系数及结合其它参数将不同纸塑复合包装材料中污染物184和651向不同食品模拟物的迁移实验值与有限厚纸层迁移模型预测值进行了对比得出结论当预测模型中采用的污染物在塑料涂层中的扩散系数为高估扩散系数时预测模型能最大限度的保证包装的使用安全性另外得出结论无限厚纸层迁移预测模型不适合纸厚度较薄的纸塑复合包装材料中污染物向食品或食品模拟物中迁移量的预测
2007,UV金属油墨的特性与用途--《丝网印刷》,UV油墨 金属油墨 网版印刷,"介绍了UV金属油墨的种类、特性与使用范围,并就UV金属油墨的印刷色序、固化工艺以及正确选用进行了详细论述。"
2017,可逆温变转色UV油墨及其变色特性--《包装工程》,可逆温变转色 微胶囊 UV油墨 变色特性,"目的制备环保、适用范围广的温变转色防伪油墨。方法利用隐色染料(热敏黑)、显色剂(双酚A)及溶剂(十四醇)组成可逆温变转色复配物,然后用原位聚合法对复配物进行微胶囊包覆,最后将微胶囊加入UV连接料体系中制成可逆温变转色UV油墨,分析油墨的色度学特性。结果当乳化转速为16 000 r/min、p H值为2~3、乳化温度为45℃、乳化时间为30~40 min时,微胶囊粒径较小,显色效果较好。对该可逆温变转色UV油墨样品进行CIE-Lab色度学特性分析,在整个加热/冷却循环后,温变转色油墨又回到初始明度值,油墨样品明度发生滞后现象,整个过程中样品的明度值形成一个闭环的回路。结论该法制备的可逆温变转色油墨具有检测方便、变色效果明显等优点,在包装防伪印刷中具有广阔的应用前景。"
2014,水性UV油墨的制备及表征--《包装工程》,水性UV油墨 高速分散法 配方设计 包装印刷行业,"目的为了确定水性UV油墨的制备、表征及其配方。方法采用高速分散法将连接料、颜料、去离子水和助剂分散均匀即可制得水性UV油墨,探讨了连接料的含量、光固化时间对水性UV油墨附着牢度的影响,以及光引发剂用量、墨膜厚度对墨膜光固化时间的影响。结果连接料的较佳质量分数为60%,墨膜的适宜固化时间为6 s,光引发剂的较佳用量为2%,墨膜的适合厚度为10μm。当m(连接料)∶m(颜料)∶m(乙醇和水)∶m(光引发剂)=6∶1∶2.8∶0.2时,水性UV油墨的综合性能较佳。结论该水性UV油墨具有干燥速度快、无污染、印刷质量高等优点,可广泛应用于包装印刷行业。"
2012,UV油墨固化速率的影响因素研究--《中国印刷与包装研究》,光引发剂 UV油墨 固化速率,"UV油墨固化速率不仅受到油墨中各组分的影响,而且与墨膜厚度有密切关系。本研究分别使用不同种类的预聚物、单体、光引发剂配制油墨,研究油墨各组分对UV油墨固化速率的影响;进而固定油墨其他组分,改变光引发剂种类及其含量配制油墨,并制备不同墨层厚度的样品,测试不同墨层厚度下的油墨预聚物双键转化率,分析光引发剂种类及其含量与不同厚度墨膜固化速率的关系。测试不同UV光源功率下的双键转化率,研究含不同光引发剂的油墨在不同功率下的固化速率。研究结果表明,油墨各组分对UV油墨固化速率有一定影响,此外,随着墨层厚度的增大,油墨双键转化率降低;当光引发剂含量小于10%时,UV油墨的固化速率随着光引发剂含量的增加而增大;UV油墨的双键转化率随着UV光源功率的增大而增大。"
2018,改性UV油墨对印刷薄木耐光变色性能的影响--《浙江农林大学学报》,木材科学与技术 薄木 紫外光固化(UV)油墨 纳米二氧化钛 纳米氧化锌 耐光变色,"利用纳米二氧化钛和纳米氧化锌作为改性剂改性红色紫外光固化(UV)油墨和黄色UV油墨,并使用改性后的UV油墨印刷杨木薄木,采用激光粒度仪、紫外可见分光光度计和色彩分析仪表征了改性UV油墨的物理性能和老化前后印刷薄木的颜色变化。结果表明:改性后的UV油墨粒径变化较小;纳米二氧化钛和纳米氧化锌均能提高UV油墨在紫外区的吸光度,随着添加量的增加而增强;采用适量的纳米二氧化钛或纳米氧化锌改性UV油墨能够改善印刷薄木的耐光变色性能,但纳米氧化锌改性UV油墨印刷薄木的耐光变色性能优于纳米二氧化钛。纳米氧化锌在红色UV油墨中添加的较优质量分数为1.5%,印刷薄木的色差(ΔE*)为0.41,比未改性红色UV油墨印刷薄木降低了78.1%;纳米氧化锌在黄色UV油墨中添加的较优质量分数为0.5%,印刷薄木的ΔE*为3.12,比未改性黄色UV油墨印刷薄木降低了66.9%。"
2016,UV油墨光引发剂在食品包装材料中的残留分析--《包装工程》,光引发剂 UV油墨 残留量 包装材料,"目的研究UV油墨光引发剂在食品包装材料中的残留行为。方法以2种常用的UV油墨光引发剂EDB和907为研究对象,分别以PET薄膜和铜版纸为承印材料,通过IGT印刷适性仪控制印刷膜层厚度,IGT UV干燥器控制紫外光固化时间,研究光照能量、墨层厚度和油墨浓度对光引发剂在食品包装材料中残留的影响。结果光引发剂残留量会随着光照能量的增加而减少,随着墨层厚度增加而增加。对于PET薄膜,油墨含量高时光引发剂的残留量比油墨含量低时大,而铜版纸结果相反,油墨含量高时光引发剂的残留量较小。结论在实际UV油墨印刷中,应提高光照能量,对于不同的承印材料应采用含量不同的油墨,以减少光引发剂的残留,降低其迁移风险,增加食品包装的安全性。"
2010,UV油墨及应用技术--《中国印刷与包装研究》,UV油墨 分散性 固化速度 附着力,"UV技术在诸多领域有着广泛应用,UV油墨具有固化速度快、印刷质量高、无VOC排放等优点,作为一种环保型油墨,在各种印刷方式中的应用越来越受到重视。本文阐述了UV油墨体系的主要成分——预聚物、单体等的结构特点及UV固化机理;结合UV油墨技术发展趋势,探讨了UV喷墨油墨分散性及其评价方法、流变学特征;根据实验研究结果,从反应动力学的角度论述了UV油墨的固化速度及氧对聚合反应的影响规律;考察了UV胶印油墨的转移率及其在低能表面承印材料的附着力。"
2012,引发剂对UV油墨固化速度影响的研究--《应用化工》,引发剂 固化速度 复配 UV固化 油墨,"为提高UV油墨的固化速度,研究了羟烷基苯酮类1173、胺烷基苯酮类907、酰基磷氧化物类819、二苯甲酮类BP、硫杂蒽酮类ITX 5种引发剂及复配对UV油墨固化速度的影响。结果表明,引发剂浓度为2%,颜料浓度为4%,单体浓度为30%时,引发剂1173、BP的固化时间分别为20.88 s和70.56 s,引发剂907的光固化时间为7.14 s,引发剂819和ITX的光固化时间均可达到1.5 s。引发剂1173与BP进行1∶3复配时,固化速度是BP的4.9倍;引发剂907与BP进行1∶3复配时,固化速度是BP的4.3倍;引发剂ITX与907进行1∶1复配时,固化速度是907的2.3倍。"
2009,UV油墨的制备与性能优化--《精细化工中间体》,UV油墨 正交实验设计 配方 单体,"探讨了预聚物、单体、光引发剂、颜料等组分对UV油墨固化速度、附着力、耐抗性等性能的影响,应用正交实验设计方法对UV油墨各组分种类进行选择,对正交试验结果做极差分析及方差分析,结果表明:根据预先设计的组分比例,采用预聚物PQ611,单体A,光引发剂B,活性氨为加速剂,获得性能较好的UV油墨。"
2009,UV油墨光引发剂与颜料匹配的研究--《包装工程》,光屏蔽 透光窗口 颜料匹配 固化速率 光引发剂 固化油墨 吸收光谱 固化体系 低聚物 活性稀释剂,"UV油墨固化体系的关键组分是光引发剂,确定颜料的透光窗口是选择光引发剂的主要依据。阐述了影响油墨固化的相关因素,提出了确定UV油墨透光窗口的方法,并以此为基础讨论了UV油墨光引发剂与颜料匹配和印刷工艺色序的问题。"
2017,LED铝基板用UV油墨的制备及性能研究--《中国胶粘剂》,混杂型 紫外光固化油墨 固化速率 膜性能,"以环氧丙烯酸酯树脂(牌号6233)、聚氨酯丙烯酸酯树脂(牌号6112-100)和脂环族环氧树脂(牌号TTA26)为预聚体,并引入活性稀释剂、光引发剂和填料等助剂,采用自由基和阳离子UV(紫外光)固化工艺制备了LED(发光二极管)铝基板用UV油墨。研究结果表明:制备混杂型UV油墨的最佳工艺条件是m(6112-100)∶m(TTA26)=35∶65、w(活性稀释剂)=11%、w(光引发剂)=5%和w(钛白粉)=27%(均相对于预聚体总质量而言),此时该油墨的固化速率适中、附着力(为96%)相对较大、折射率(为1.60)相对较高且不发生黄变现象,并且膜性能优异。"
2014,基于UV油墨的3D地形图呈现--《包装学报》,D打印 等高线 UV油墨 地形图,"根据地形图的特点及UV油墨快速干燥的特性,提出一种运用3D建模和分层设色的方法,并通过实验,完成了中国台湾省主岛部分3D地形图的打印。选择台湾省主岛部分等高线图,在图形处理软件中,根据其高程,提取多幅等高线矢量图;根据墨层厚度与打印层数的定量关系,得到实际海拔高度与打印层数的对应关系,再根据等高线分层设色原理,设计分层设色对应表,并设定适当的比例尺,确定打印方案;使用喷墨打印机,打印得到具有一定立体感的3D彩色地形图。实验结果表明:根据UV油墨快速干燥的特点,使用UV喷墨打印机,可以打印得到具有立体效果的3D彩色地形图。"
2012,UV油墨、UV技术与UV艺术装饰--《丝网印刷》,发泡油墨 艺术装饰 玻璃装饰 特殊效果 技术 双重固化 个性化 金属化 艺术化 喷墨印刷,"UV油墨、UV技术与UV艺术装饰三者是相互关联的。要进行艺术装饰,不管是家电玻璃面板、还是家庭装饰中的艺术吊顶、橱柜面板、玻璃背景、隔断、移门等产品,首先都离不开新材料、新油墨。使用UV油墨,采用UV"
