紫外线固化 印铁油墨 研制,"介绍了UV印铁油墨的配方和生产工艺;分析了UV印铁油墨的技术指标,并与国内外同类产品进行了成本比数;探讨了颜料对光固性能、颜料对贮存稳定性能、阻聚剂对油墨稳定性能、光敏剂量对涂膜性能对紫外线固化印铁油墨的影响,同时还对UV印铁油墨贮存效果进行了分析。"
绿色印刷 印刷企业 环境保护 身体健康 环境友好 建设阶段 新闻出版 环保标准 可持续发展内涵 绿色认证,"""绿色""是世界各国普遍认同的,对具有""环境友好""与""健康有益""两个可持续发展内涵属性事物的一种约定俗成的称谓。""环境友好""指具有环境保护、节能减排、低碳经济、循环经济等行为特性;""健康有益""指与同类产品相比,具有维护人群身体健康的行为"
二氧化钛 氧化硅包覆 氧化铝包覆 聚酯催化剂,二氧化钛表面处理技术已经成为二氧化钛行业最为重要的核心竞争能力可以预期在当前和今后相当长一段时间二氧化钛行业的竞争在相当大的程度上将体现为二氧化钛表面处理技术的竞争面对国际二氧化钛行业竞争加剧而我国在二氧化钛表面处理技术方面的落后已经使我国二氧化钛行业在国际竞争中处于十分不利的地位这一局面本文从二氧化钛的表面无机纳米膜修饰机理纳米膜结构对二氧化钛颜料性质影响二氧化钛在聚酯催化中的应用等三个方面展开研究希望本研究工作能对我国二氧化钛行业的发展提供积极的建设性贡献本文研究了以硅酸钠为原料利用液相沉积法在金红石型二氧化钛表面包覆二氧化硅纳米膜使用透射电镜分析了二氧化钛表面二氧化硅包覆膜的形貌结合红外光谱X光电子能谱Zeta电位分析技术研究了金红石型二氧化钛表面包覆二氧化硅纳米膜的成膜机理以激光粒度测定仪分析了二氧化硅包覆二氧化钛样品在水溶液中的分散程度研究表明当反应温度反应液pH值二氧化硅包覆量较低时二氧化钛表面形成了岛状二氧化硅包覆层当反应温度反应液pH值二氧化硅包覆量较高时二氧化钛表面形成了连续而均一的二氧化硅膜状包覆层二氧化硅包覆层厚度随着硅酸钠与二氧化钛摩尔比的增加而增加二氧化硅包覆层以TiOSi键化学键合形式结合于二氧化钛表面当硅酸钠与二氧化钛摩尔比大于175时二氧化硅包覆二氧化钛样品的Zeta电位基本保持为50mV不变与纯金红石型二氧化钛的Zeta电位24mV相比带有更多的负电荷在静电排斥的作用下有利于包覆样品在水中的分散反应液pH值为910时二氧化硅包覆二氧化钛样品在水中分散性优于纯金红石型二氧化钛在水中的分散性当硅酸钠与二氧化钛摩尔比为115时二氧化硅包覆二氧化钛样品在水中形成单分散二氧化钛表面包覆二氧化硅后提高了二氧化钛的白度亮度及其在水中的分散性包覆样品的光散射率与二氧化钛和二氧化硅本身性质及包覆样品分散性有关本文以硫酸铝为原料利用液相沉积法在金红石型二氧化钛表面包覆氧化铝纳米膜使用透射电镜分析了二氧化钛表面氧化铝包覆膜的形貌通过红外光谱X射线光电子能谱和粉末衍射分析技术研究了金红石型二氧化钛表面包覆的氧化铝纳米膜的化学组成与成膜机理以激光粒度测定仪分析了氧化铝包膜后二氧化钛样品在水溶液中的分散程度实验表明氧化铝在二氧化钛表面包覆程度受反应液pH的影响在pH89的范围内氧化铝在二氧化钛表面形成了连续包覆膜氧化铝纳米膜以薄水铝石的形式存在二氧化钛与包覆层薄水铝石之间形成TiOAl键使氧化铝包覆层结合在二氧化钛表面上氧化铝包覆二氧化钛样品的包覆量随硫酸铝与二氧化钛的摩尔比的增加而增加在二氧化钛表面包覆氧化铝可以改善二氧化钛粉体在水中的分散性粉体在水溶液中的分散性随包覆程度提高而提高氧化铝包覆二氧化钛样品的白度亮度高于原料二氧化钛的白度亮度包覆样品的光散射率与氧化铝包覆量有关本文在进行二氧化钛催化聚酯反应的研究中以硫酸法二氧化钛生产过程中二氧化钛的前驱体偏钛酸为原料通过热处理工艺参数的调整制备一系列二氧化钛粉体根据本论文前半部分的研究结果分别以九水硅酸钠和硫酸铝为无机包覆剂对二氧化钛粉体进行氧化硅氧化铝包覆用脂肪醇作为有机修饰剂分别对未进行无机包覆和无机包覆后的二氧化钛粉体进行表面修饰制得在乙二醇体系中良好分散的二氧化钛催化剂将所得催化剂用70升的装置进行聚酯合成实验通过进行酯化反应动力学研究评价该催化剂体系在聚酯合成中酯化阶段的催化活性实验表明催化剂酯化催化活性与粉体煅烧温度相关高活性二氧化钛催化剂的最佳煅烧温度为600酯化催化活性与二氧化钛粉体的包覆状态有关氧化硅包覆组的酯化催化活性总体上高于氧化铝包覆组和未包覆组主要是由于Ti02Si02具有较强的酸性催化剂缩聚催化活性研究发现未包覆组明显比包覆组要高氧化硅包覆组和氧化铝包覆组中粉体煅烧温度600时表现出高的催化活性对二氧化钛粉体进行无机包覆会降低催化剂的缩聚催化活性粉体煅烧温度也与催化剂的缩聚催化活性有一定的相关性自制催化剂合成的聚酯样品与乙二醇锑合成的聚酯样品相比常规性能相近热转变温度均有所升高热稳定性较好
绿色印刷 新闻出版 环境保护标准 印刷工作 印刷企业 实施 印刷行业 平版印刷 环境标志产品 生态文明,"为推动我国生态文明、环境友好型社会建设,促进印刷行业可持续发展,根据《中华人民共和国环境保护法》和《印刷业管理条例》有关规定,新闻出版总署和环境保护部决定共同开展实施绿色印刷工作。有关事项公告"
数字印刷系统 标准体系表 数字印刷机 成像技术 印刷技术 基本状况 印刷标准化 健康发展 印刷市场 印刷企业,"质检公益性行业科研专项项目是国家质检总局、财政部、科技部为贯彻落实《国家中长期科学和技术发展规划纲要(2006—2020年)》,支持开展公益性行业科研工作而设立的中央财政专项,旨在通过对行业应急性、培育性、基础性科研课题的研究,提高行业科技发展支撑力度,推动行业的技术进步。""数字印刷标准体系表""是我国印刷业第一次申请的质检公益性行业科研专项项目。项目的立项与开展得到新闻出版总署、国家标准化管理委员会的关心与支持,得到印刷行业众多企业、单位与专家的支持与参与。项目于2008年经国家质量监督检验检疫总局批准,2009年2月开始实际运作,历时两年完成。在由全国印刷标准化技术委员会、中国印刷技术协会、北京印刷学院、北京北大方正电子有限公司等单位专家组成的项目研究组的组织下,相继对我国当前数字印刷的现状进行了调研,对国际与数字印刷有关联的印刷标准进行了搜集、整理与研究,组织召开了10余次不同范围的专题研讨会,完成了3个专题的报告,即《我国数字印刷基本状况报告》、《建立我国数字印刷标准体系的必要性、目标、主要内容及基本原则》、《关于〈数字印刷标准体系表〉的建立、实施及相关措施的报告》,并提出了《数字印刷标准体系表》标准草案。质检公益性行业科研专项项目——""数字印刷标准体系表""的研究是解决数字印刷标准制定相对技术发展严重滞后的有力措施,不仅明确了数字印刷系列标准制定的指导思想,更重要的是对于统一全行业对数字印刷的认识、促进我国数字印刷的健康发展、规范数字印刷标准的制定具有重要的现实意义和深远的影响。现该项目已通过国家验收,特将分期刊登,以飨读者。"
水性油墨 丙烯酸 低分子量,本课题系企业委托研发项目目的是合成一种丙烯酸苯乙烯聚合物目前该聚合物主要应用于水性油墨连接料在国内使用十分广泛该类水性树脂的生产可以取代国外进口产品市场前景良好聚合物的主要技术指标和特点是数均分子量3000左右窄分子量分布玻璃化转变温度约100无色透明具有良好碱水溶解性其中控制树脂低分子量和窄分布保证树脂外观的无色透明是本课题主要难点课题主要从溶剂引发剂种类及用量反应温度选择生产工艺流程四个方面研究解决生产中的问题研究采用了半连续反应溶液聚合法使用丙烯酸苯乙烯甲基丙烯酸甲酯单体三元共聚合三种单体的实验配方比例为32608合成出的树脂玻璃化转变温度约100树脂羧酸含量合适酸值约为210碱水溶解性能良好且树脂透明有光泽研究中筛选对比了多种工业上常见的溶剂发现使用乙醇独甲醚作溶剂体系沸点可以达到比较理想的约121利于分子量控制同时该溶剂能很好的分散和溶解引发体系各种单体及共聚合产物更重要的是使用乙二醇独甲醚溶剂得到的聚合产品无色透明解决了树脂外观达不到进口标准的难题研究发现反应温度从聚合物分子量共聚物无规度引发剂半衰期匹配三方面影响聚合反应高温利于分子量降低反应温度在110以上合成的共聚物无规度高丙烯酸单元在链段上分布均匀能保证产品透明性和溶解性能引发剂半衰期随反应温度的升高而降低引发剂半衰期要控制在1小时以内才有利于反应的控制对比研究了多种引发剂和引发体系发现单独使用质量分数4至6份BPO或TBPB作引发剂在121下可聚合产生一系列数均分子量低于5000的树脂实现了对产品分子量控制的问题满足了产品低分子量的要求研究了引发剂加料工艺与引发剂消耗速率的关系提出了理论计算模型并通过实践结果证明得到了最佳工艺路线为使用BPO与TBPB复配引发剂采用50TBPB预加BPO和50TBPO滴加的生产工艺可以在使用总计4份引发剂量时生产分子量约3000窄分布无色透明具有良好水溶性的树脂本课题还对树脂进行了放大实验采用的是自行设计的带搅拌不锈钢夹套反应釜反应釜设计容量8升取得了成功为工业生产奠定了良好的基础
油墨废水 废水处理 物化处理 生化处理,"近年来,我国油墨行业得到了飞速发展,油墨废水的排放量也相应地急剧增加,废水一旦进入水体,会对水环境造成严重的污染,严重威胁着人类的生产生活和自然界的生态平衡,对油墨废水的处理必不可少。简单介绍了油墨的种类和油墨废水的成分,综述了近年来国内外关于油墨废水处理技术的研究现状,并展望了未来发展方向。"
中文印刷字体 单字 美术作品 字体字库软件 软件作品,"在我国现行著作权法构架下,具独创性的中文印刷字体单字属于美术作品,而中文印刷字体因其不具有可复制性,故不是作品。中文印刷字体字库包括数字化的计算机软件字库,因其整体缺乏独创性从而不构成作品。具独创性的中文印刷字体单字美术作品与作为中文印刷字体软件字库之技术工具的计算机软件作品是不同的作品并具有不同的使用。"
铜版纸 涂布白卡纸 平版胶印 色斑 印刷适性,"铜版纸和涂布白卡纸是高档印刷品的主要承印介质。印刷过程中经常发现不同品牌甚至同一厂家不同批次的纸张印刷质量呈现出很大差异。本文通过分析单张胶印中油墨与纸张的相互作用,讨论了引起印刷缺陷的原因,包括油墨干燥不良、掉粉、水干扰与逆传递印刷色斑等,提出造纸厂家及印刷工作者应该采取的根治或减轻不同印刷缺陷的措施。"
纳米SiO 水性油墨 抗紫外线率,"食品安全包装对油墨的环保性能和抗老化性能提出了更高的要求,研究了一种具备抗紫外线的纳米SiO2油墨,其中纳米SiO2微粒利用化学沉淀法制得,并用XRD和马尔文Zteaszier Nano-ZS表征,其结果表明,纳米SiO2为粒径分布在100 nm以下的无定形粉末。在自制的水性油墨中加入纳米SiO2及分散剂,超声波分散后测试该油墨对紫外光的吸收率,结果表明:研制的纳米SiO2水性油墨对紫外光具有90%以上的屏蔽率,在食品安全和油墨抗老化性方面具有很好的应用价值。"
大豆油墨 VOC 环保性 印刷适性 应用现状 前景,"中国印刷及设备器材工业协会统计,2009年我国印刷工业总产值为5150亿元,较上年度增长8.4%。预计2015年我国印刷工业总产值将达到9800亿,也"
绿色包装 分级标准 包装材料 包装机械 包装安全及环境,"绿色包装是世界包装发展的必然趋势,也是中国由包装大国跨向包装强国最重要的发展战略。基于绿色包装的内涵与技术,概述了中国绿色包装15a来在包装材料、包装机械和包装材料安全及环境等方面所取得的成就。"
绿色印刷 印刷企业 印刷业 发展规划 社会责任 循环经济 印刷产品 印刷行业 实施 绿色标准,"我国印刷业""十二五""时期发展规划明确提出建设印刷强国的目标要求,且在""十二五""期末要取得重大进展,印刷工业总产值预计要达到11000亿元人民币,即比""十一五""期末翻近一番。这个刚性指标的质量内涵,那就是绿色的GDP。1实施绿色印刷是企业的社会责任绿色印刷的内涵和宗旨是""环境友好""与""健"
水性油墨 水性连结料 助剂,"水性油墨因其优良的环保性,受到越来越多的关注,成为现今油墨行业发展的方向和趋势。本文系统介绍了水性油墨的组成和质量控制指标,指出了影响水性油墨印刷质量的关键因素,综述了水性油墨研究发展历程,简要分析了我国水性油墨研究现状和技术方向,展望了水性油墨的发展趋势。"
印刷检测系统 图像配准 缺陷检测 人眼视觉特性,目前国内的大多数中小型印刷企业对基于机器视觉和图像处理理论的印刷品缺陷自动检测系统的需求相当迫切国内在此方面的研究才刚刚起步因此开展此方面的研究对提高我国印刷行业的整体水平具有重要的作用本文主要研究了以下内容第一印刷品图像预处理和缺陷检测算法是印刷缺陷检测系统的核心本文首先分析了印刷检测系统面临的几个图像预处理问题包括彩色印刷品的灰度化噪声的滤除印刷图像的配准图像的差分等并针对以上问题提出了相应的解决方案图像配准算法是图像预处理中的难点因此我们根据系统的要求和对常用的图像配准算法的深入对比研究探索找到了适合印刷检测系统的配准算法基于金字塔和模板匹配的图像配准算法实验验证了该方法不仅有较高的配准精度也具有较高的配准速度能满足检测系统对图像处理的实时性和精度的要求第二本文提出了基于人眼视觉特性评价的图像缺陷检测方法该方法首先利用区域分割算法对印刷差分图像进行缺陷区域分割其次结合数学形态学方法对各个缺陷区域进行特征分析这些特征包括缺陷的大小类型面积等信息最后根据人眼的视觉特性对缺陷进行了客观质量评价根据评价的结果来判定缺陷对图像的影响程度实验证明该方法具有良好的人工智能性能够满足印刷检测系统对印刷缺陷的检测标准要求第三根据印刷厂商提供的印刷检测系统的功能需求设计了印刷检测系统的具体功能模块并在VC60和OPENCV的开发平台下编程实现了印刷检测系统的软件功能部分该软件部分能支持印刷品图像的输入图像的预处理缺陷检测缺陷列表输出人机交互查看缺陷等功能
光固化 光引发剂 紫外光引发剂,"光引发剂是光固化(射线固化)材料的关键组成部分,对光固化速度起着决定性的作用。本文全面、系统地阐述了近年来光引发剂的技术进展,并在光引发剂分类的基础上,详细介绍了数种市售新型光引发剂的化学结构、性能和用途。"
绿色印刷 新闻出版局 环境保护 美好生活 印刷协会 印刷企业 中国印刷 股份有限公司 产学研合作 示范园区,"2011年11月1～4日,全国首个绿色印刷宣传周正式启动。根据2010年9月环境保护部和新闻出版总署签署的《关于实施绿色印刷战略合作协议》的安排,新闻出版总署和环境保护部于2011年10月8日印发了《关于实施绿色印"
紫外发光二极管 封装 多芯片阵列 光学仿真 热管理,紫外发光二极管UVLED相比传统紫外光源具有发光效率高寿命长节能环保反应速度快体积小等特点近年来紫外LED芯片技术和封装技术得到了快速发展使其在油墨固化等行业具有巨大的市场前景多个国家和地区都争相投资研发紫外LED光源这也将进一步推动相关的光电子材料能源半导体芯片制程及封装等行业的发展目前紫外LED的光辐射功率较低除了芯片制作水平需要提高之外封装技术对紫外LED的辐射特性也有重要的影响本文主要工作是围绕紫外LED的封装工艺研究在理论计算和仿真的基础上进行了紫外LED封装的总体设计提出了一种光热管理良好的紫外LED封装结构具体包括以下内容首先介绍了课题研究背景和目前国内外紫外LED芯片和封装技术的最新进展同时分析了紫外LED的发展趋势和市场应用前景最后给出了目前紫外LED封装研究中的一些问题接着从理论出发建立了紫外LED封装中两个重要的光学管理问题的理论基础一是LED透镜的光路原理二是平面和弧面多芯片阵列LED面光源的光辐射空间分布前者可用来指导LED透镜的结构设计后者可用来优化LED面光源的设计最后通过光学仿真详细讨论了LED各封装结构参数对光辐射的影响为LED面光源的优化设计指明了方向再次在理论设计和仿真的基础上结合紫外LED高能量和热流密度的实际情况选用合理的封装材料设计了一种具有良好热管理的紫外LED封装结构同时给出了空间弧形机械结构的设计实例和探讨最后对所制得的紫外LED封装样品围绕光辐射和封装结构温度进行了光学热学系列测试并对测试结果进行了分析测试量包括温度光辐射强度辐射波长等这些测试紧密围绕所设计的封装结构进行探讨了封装结构对LED模块的光热性能表现的影响本课题力求解决在紫外LED封装中遇到的实际问题因此本文具有重要的实用价值
环保 水性塑料复合油墨 塑料薄膜附着牢度 复合强度,水性凹版油墨是当今最为环保的印刷油墨之一也是目前唯一被美国FDA推荐和认可的可以用于与食品直接接触的印刷油墨在我国虽然纸张印刷的水性油墨已经市场化但是在大量用于食品包装塑料薄膜印刷由于薄膜的不吸收缺点使薄膜印刷水性油墨还处于研究起步阶段本实验就是在已经市场化的仅用于吸收性纸张表面印刷的水性凹版油墨基础上通过对所开发的水性油墨所用到的颜料树脂助剂等原料从剥离强度附着力以及适合蒸煮的耐高温等方面进行优化与筛选最终开发出以丙烯酸类胶体树脂为主要研磨树脂丙烯酸改性的聚氨酯分散体胶体为主要连接料的水性复合里印耐蒸煮的凹版油墨并且使该油墨在多种不吸收的塑料薄膜如聚酯PET取向聚丙烯OPP尼龙NY等薄膜材料上顺利高速印刷并复合后完全能够达到目前同类溶剂型油墨才具有的优异印刷适性高耐热性高剥离强度高附着力等各项性能相信如果这一新型环保油墨面市后一定会给国内的食品包装市场带来一场绿色风暴
环境标志 环保认证 绿色印刷,"国务院于2011年10月发布的《关于加强环境保护重点工作的意见》明确要求大力发展环保产业的同时,又以发展环境服务业为重点。其中特别指出:""着重发展环保设施社会化运营、环境咨询、环境监理、工程技术设计、认证评估等环境服务业。鼓励使用环境标志、环保认证和绿色印刷产品。""为落实国务院文件精神,将环境标志、环保认证和绿色印刷工作推向新的高度,本文研究提出以下战略性举措:第一,加强环境标志工作,积极引导可持续消费,促进节能减排目标的实现;第二,规范环保认证市场,提升环保认证水平,增强环保认证的信任度;第三,推进实施绿色印刷战略,促进印刷行业发展方式的转型与升级。"
绿色印刷 认证,"人类在100多年工业化的进程中,不少生产企业以牺牲环境为代价。严重的环境污染现已警醒了人们,引起了重视。节能减排的紧迫任务严峻地摆在世人面前。印刷业也毫不例外地受到挑战。印刷企业虽然属文化产业,实施的却是工业化生产,绿"
绿色印刷 新闻出版 环境保护标准 印刷品 印刷企业 实施 印刷工作 环境友好 发行 管理,"顺应低碳时代潮流什么是绿色印刷?我国为什么要实施绿色印刷?印刷发行管理司:绿色印刷是指对生态环境影响小、污染少、节约资源和能源的印刷方式。绿色印刷的宗旨是""环境友好""与""健康有益""两个核心内涵,强调在顾及当代人的同时兼顾下一代人的生存"
绿色印刷 绿色认证 原辅材料 设备供应商 平版 印刷企业 新闻出版 印刷业 环境保护 绿色环保,"构建环保体系,引导绿色转型,发展绿色印刷已成为印刷业""十二五""规划的主旋律,也是我国印刷技术发展的主攻方向。国家新闻出版总署与环境保护部在2010年启动""绿色环保印刷体系建设工程"",绿色印刷正向我们走来。"
节能减排 绿色印刷 现状 发展,"面对全球气候变化的挑战,节能减排、低碳经济等已成为人类社会可持续发展的重要内容。对于我国印刷行业来说,使用绿色原料、实施绿色工艺的绿色印刷已经是印刷企业的共识。阐述了绿色印刷目前在国内外的发展现状,预测绿色印刷的未来发展方向将是对印刷工业废气、废液和固体废弃物的清洁、降解处理的先进环保技术,印刷废料的回收以及整个流程中的过程控制和节能减排。"
喷墨印花机 纺织品 数码印花 数码喷墨印花 现状与发展趋势 墨水 丝网印刷 数字化技术 染料 印前处理,"对于关注印花的人们来说,喷墨印花已经不是新鲜的名词了。自其产生以来,喷墨印花相对于传统印花的强劲优势使得业界越来越关注喷墨印花的发展动态。本文针对数码喷墨印花的现状和发展趋势进行了简要的总结。"
光引发剂 UV油墨 固化速率,"UV油墨固化速率不仅受到油墨中各组分的影响,而且与墨膜厚度有密切关系。本研究分别使用不同种类的预聚物、单体、光引发剂配制油墨,研究油墨各组分对UV油墨固化速率的影响;进而固定油墨其他组分,改变光引发剂种类及其含量配制油墨,并制备不同墨层厚度的样品,测试不同墨层厚度下的油墨预聚物双键转化率,分析光引发剂种类及其含量与不同厚度墨膜固化速率的关系。测试不同UV光源功率下的双键转化率,研究含不同光引发剂的油墨在不同功率下的固化速率。研究结果表明,油墨各组分对UV油墨固化速率有一定影响,此外,随着墨层厚度的增大,油墨双键转化率降低;当光引发剂含量小于10%时,UV油墨的固化速率随着光引发剂含量的增加而增大;UV油墨的双键转化率随着UV光源功率的增大而增大。"
引发剂 固化速度 复配 UV固化 油墨,"为提高UV油墨的固化速度,研究了羟烷基苯酮类1173、胺烷基苯酮类907、酰基磷氧化物类819、二苯甲酮类BP、硫杂蒽酮类ITX 5种引发剂及复配对UV油墨固化速度的影响。结果表明,引发剂浓度为2%,颜料浓度为4%,单体浓度为30%时,引发剂1173、BP的固化时间分别为20.88 s和70.56 s,引发剂907的光固化时间为7.14 s,引发剂819和ITX的光固化时间均可达到1.5 s。引发剂1173与BP进行1∶3复配时,固化速度是BP的4.9倍;引发剂907与BP进行1∶3复配时,固化速度是BP的4.3倍;引发剂ITX与907进行1∶1复配时,固化速度是907的2.3倍。"
