大豆油 油墨 胶印 环保,在传统油墨中一般含有3060的石油系矿物油属有机溶剂含芳烃当印刷时油墨的干燥需要挥发这些矿物油会释放出大量有机溶剂造成严重的大气污染全球每年因油墨引起的有机挥发物VOCVollitileOrganicChemicals污染排放量已达几十万吨这些有机挥发物可以形成比二氧化碳更严重的温室效应而且在阳光的照射下会形成氧化物和光化学烟雾严重污染大气环境对于印刷工人由于长期处于高浓度的VOC中会对人体特别是神经系统造成极大损害因此如何减少油墨中VOC的含量成为各国治理环境的重中之重现在各国也都开始陆续制定严格的法令法规以限制有机溶剂的使用和排放大豆油墨是将传统油墨配方中2050的的矿物油替代为自然环保的大豆油从而使油墨中的VOC含量由原来的3060降低到515因此在环保呼声的推动下大豆油墨必将成为今后胶印印刷用油墨的主流尽管大豆油墨具有很好的环保前景但由于大豆油自身的特点给大豆油墨的开发带来一定的难度其主要的难点在于①大豆油墨的干燥性问题②调整大豆油墨墨性使其接近甚至超过传统油墨大豆油中只有9双键含量较多的亚麻酸而双键含量较少的硬脂酸油酸和亚油酸却占到了近80与其相比传统的亚麻油中亚麻酸含量在52以上亚油酸等双键较少的植物油酸只占了30左右因此大豆油由于含有的较少的可反应双键与空气中的氧气反应相对缓慢使制造出的大豆油墨出现干燥不良会给印刷带来如粘脏附着力差等许多问题也使油墨的可印刷性和印刷效率大大降低同时由于大豆油替代了传统油墨配方中的部分矿物油打破了传统油墨的墨性平衡使大豆油墨在流动性水墨平衡等方面都与传统油墨有一定的差距这就需要通过全新的油墨配方将其重新达到平衡使大豆油墨能在印刷中得到接近传统油墨甚至更好的表现对于油墨来说影响其干燥性的不只是植物油还有树脂矿物油连接料制造工艺等因素也会很大程度上影响油墨的干燥性所以尽管大豆油自身在干燥性方面存在不足但完全可以通过树脂的选择和调整连接料的配方改进连接料制造的工艺以及油墨配方的合理配比来克服大豆油的干燥性问题依据以上思路本文着重针对树脂的选择连接料配方和工艺的调整以及油墨配方的合配比展开研究工作
柔印技术 母版制版机 柔性印刷机 柔印版材,"通过对柔印技术的发展历程回顾,与其他三大印刷术(胶印、凹印和丝印)比较、剖析,阐述了 国内外柔印的各种优点及其潜在实惠,认为柔印技术在将来一定时期内会逐渐占领印刷业市场更大份额,虽不 可能一统市场,但柔印业具有广阔的发展前景。"
膜分离技术 造纸废水 应用,"膜分离技术是近年发展起来的一门高新技术,在造纸废水处理方面具有广阔的应用前景。文章介绍了膜分离技术的工作机理、特点以及国内外在造纸废水处理方面的研究进展。另外,对膜分离技术在应用过程中出现的问题进行了讨论,并提出了可能的解决方案。"
大豆油墨 环保 印刷油墨,"本文简要地介绍了大豆油墨的研发历史、功能特性及应用现状 ,大豆油墨的研发是油脂行业对环保的一份贡献。"
水性光固化涂料 聚氨酯丙烯酸酯 流变 相反转 微凝胶,本文以水性紫外光UltrayioletUV固化聚氨酯丙烯酸酯为研究对象针对水溶性和水乳液型聚氨酯丙烯酸酯制备及应用中的若干问题进行了深入的研究并结合树脂的特殊结构创新性地将其应用于乳液聚合微凝胶中为了研究高固含低粘度的UV固化聚氨酯丙烯酸酯水溶液设计了四种高羧基含量的树脂并根据分子结构确定了合成路线合成和表征了各自的分子结构树脂考察了其在水中的溶解性得到两种水溶性优良的且具有UV活性的聚氨酯丙烯酸酯预聚物TDG和IDG揭示羧酸含量不是聚合物获得优异水溶性的充分条件通过对TDG和IDG水溶液流变行为的研究发现其在浓度55以下粘度都较低且增长缓慢呈牛顿流体是一种高固含低粘度的水溶液深入研究了溶剂用量对自乳化型聚氨酯丙烯酸酯的乳液相反转过程和乳液最终性能的影响对相反转过程中的体系流变行为和电导率进行跟踪监测发现一定量的溶剂丙酮可以大大降低乳液相反转过程的粘度然而过量的溶剂会破坏乳液的稳定性溶剂用量存在一个使乳液稳定的临界值利用三角形相图和FC两维相图对这一现象进行解释同时研究了羧基含量对乳液相反转的影响找到了使乳液稳定的羧基含量最低值由于相反转受热力学和动力学双重因素的控制搅拌转速对乳液稳定性亦有影响通过对相反转过程的研究得到了粒径均匀贮存稳定的UV固化乳液粒径可从20nm变化至130nm首次用乳液型聚氨酯丙烯酸酯在无外加乳化剂和交联剂的情况下制得微凝胶同时将其做为稳定剂和交联剂与甲基丙烯酸甲酯单体共聚合成复合型微凝胶用GPC考察分子量的变化规律得到微凝胶的合成动力学曲线微凝胶动态流变行为的研究表明其内部交联结构已经生成测量了损耗角正切和复数粘度随频率的变化发现其变化趋势与微凝胶的结构有密切关系所有合成的微凝胶在四氢呋喃中都表现出极高的粘度和强烈的剪切变稀行为对微凝胶溶胀行为的研究表明微凝胶的溶胀与聚合物组成和交联密度有关研究发现做为一种软质微凝胶聚氨酯微凝胶与硬质微凝胶有明显的不同它具有在室温下成膜的能力
,"为便于读者收集、检索中国国家标准,本刊在2005年3、4期连载国家标准(GB)题录,题录刊载了截止2005年1月中国标准化研究院标准馆收藏的全部现行标准。本刊同时发行:国家标准(GB)题录(中文电子版)单价200.00元,国家标准(GB)题录(中文合订本)单价200.00元。上述电子版用微软 Excel 软件格式排列,便于读者使用。请需要该题录或标准全文的读者按杂志地址(或电话)与杂志社联系。"
瓦楞纸板 包装材料 缓冲性能,"　随着绿色包装理念的渗入,瓦楞纸板以其可降解和可再生的特性而倍受青睐。文中从原材料、楞型结构、缓冲特性、印刷适性等方面全面地分析了瓦楞纸板作为包装材料的性能,阐述了目前瓦楞纸板研发的状态及瓦楞纸板的发展前景。"
辐射固化 光固化 UV/EB固化 紫外光,"辐射固化技术以其高效、节能、无污染、物理性能优良等优点而被誉为绿色技术 ,近年来在世界上取得了高速发展。综述了近几年来辐射固化技术的研究进展 ,包括稀释单体和预聚体、水基UV/EB固化、阳离子光固化、辐射固化粉末涂料、复合固化体系、UV固化纳米涂料、光引发剂、计算机直接制版等 ,考察了中国辐射固化市场的现状 ,对辐射固化技术的发展方向作出了预测"
喷墨印刷 成像技术 质量,"介绍喷墨印刷成像原理,以热喷墨成像系统为研究对象,探讨该系统成像机理、油墨和受像介质之间的相互关系以及对喷墨印刷质量的影响,并对如何控制关键参数进行了讨论。"
氧化铁 纳米 性质 用途,"纳米氧化铁是一种多功能材料,在催化、磁介质、医药等方面具有广泛的应用。本文综述了纳米氧化铁的结构性质及其用途。"
产品设计 绿色设计 绿色包装设计 设计流程,传统设计主要是根据该产品的性能质量和成本等指标进行设计设计过程中很少考虑产品的维护性拆卸性回收性报废产品的处理以及对生态环境的影响按传统设计生产制造出来的产品在其使用寿命结束后不能有效地回收而且其生命周期的全过程都可能造成生态环境的污染并造成资源的大量浪费影响了经济发展的可持续性绿色设计是80年代末开始出现的一股国际设计潮流绿色设计要求在设计产品时必须按环境保护的指标选用合理的原材料结构和工艺在制造和使用过程中降低能耗不产生毒副作用其产品易于拆卸和回收回收的材料可用于再生产绿色设计要求设计师具有更广博的知识和对人类持续发展的责任感以及更明晰的设计理论和系统化的设计体系因此产品设计中可行的绿色设计方法和设计流程的研究是非常必要的本论文首先分析了产品对环境的不利影响接着介绍了绿色设计的概念历史现状和发展趋势分析了绿色设计与传统设计的关系在此基础上总结了绿色设计的主要方法和具体流程然后对当前绿色设计中容易被忽视的绿色包装设计进行了详细的分析和探讨接着对绿色设计的生命周期评价方法及其运用过程中的缺陷和问题进行了讨论最后本论文以手机为实例进行了绿色设计实践
嵌入式系统 按需喷墨 喷墨喷头 DPI,随着条码标识技术的迅速发展和广泛应用人们对条码标识印制的质量速度效益的要求也日益提高比如对小批量多批次信息内容需要经常变化的条的印制如果用制胶片印刷的方式则成本相对较高不经济如果用条码打印机打印条码标签然后再粘贴的方式则速度慢且烦锁喷码技术以其非接触特性丰富的标注功能以及可靠的喷印质量得到了广泛的应用本文研究和设计了用于工业包装行业的按需喷印系统论文调查了喷印技术的现状分析了当前市场上的喷印技术以及各种不同喷印技术之间的优势和劣势并预测了喷印技术的发展趋势通过喷印技术在国内和国际市场上的发展比较以及国内市场现状的分析发现国内目前的喷印技术水平落后在按需喷印技术上严重依赖国外品牌因此在掌握喷印的基本工作原理和XJ128喷头特性的基础上给出了一种按需喷印系统的设计方案并分析了提高喷印图像DPI的方法根据工业包装行业对喷印系统的基本性能需求给出了喷印系统具体的设计详细说明了各模块硬件设计思路和软件设计方法给出设备界面的结构和部分程序流程图最后对设备样机功能进行了测试本课题研究并实现了适用于工业包装生产流水线上的喷印系统测试结果表明系统运行稳定基本实现了所设计的功能
-双(-氨基苯氧基)苯 可溶性聚酰亚胺 合成 性能,"间苯二酚和对氯硝基苯通过缩合反应,合成得到了1,3-双(4-硝基苯氧基)苯(134BNPB);随后,在Pd/C-水合肼的还原体系中,被进一步还原,得到了1,3-双(4-氨基苯氧基)苯(134BAPB)单体。基于134BAPB单体,制得了多种结构的芳香族聚酰胺酸树脂及其对应的可溶性聚酰亚胺树脂,并对它们的性能进行了研究。"
紫外光固化 聚氨酯丙烯酸酯 清漆 合成 性能研究,紫外光固化涂料因其迅速成型绿色环保及其优良的性能近年来获得了高速的发展并很快应用到各个工业领域聚氨酯丙烯酸酯光固化涂料是由聚氨酯丙烯酸酯PolyurethaneacrylatePUA树脂为主体树脂与稀释单体外加其它填料助剂共同配制成的涂料体系本论文通过对PUA合成工艺成膜性能各种影响因素的试验研究制得性能较优异的清漆漆膜总结了配制性能优异的PUA树脂涂料一般性原则为今后的进一步研究提供了一些参考在PUA树脂的合成部分主要从原料的选择预处理合成方法的选择以及合成条件的控制几个方面进行了详细的论述实验采用IPDITDIPPG2000HPMA通过本体法两步反应分别在70左右和50以下反应制得柔韧性耐黄变性良好的PUA预聚体并对各个过程的工艺条件对合成过程及产品性能的影响进行了研究总结给出了合理的解释得到了优化的工艺条件通过对自制涂料体系固化膜的多种主要性能参数如硬度附着力收缩性柔韧性耐黄变性等分析可以看出合成的涂料与市售同类产品相比具有更加优良的综合性能文中分析了体系性能优异的原因并针对每种性能的影响因素和性能控制进行了多方面研究找出了一般性的规律为今后的研究提供了一些原则性的依据本文最后在一系列试验和分析的基础之上结合当前国际趋势对PUA涂料目前的不足给予今后的一点设想
大豆油 油墨 印刷适性 应用现状 环保型 环保效果 再生纸 石油价格 印刷适应性 特点,"大豆油墨并非因为采用了大豆油就贴上了绿色的标签,而是根据油墨各个组分综合考虑,从而实现整体上的环保效果。"
喷射印花 数码 纺织品,"数码喷墨印花是近20年发展起来的一种新型印花技术,具有传统印花不能实现的优点,被誉为21世纪染整工业实现革命的关键技术之一。该讲座系统地介绍了数码喷墨印花技术的起源和应用现状,深入浅出地阐述了这一新技术的基本原理及其发展趋势。"
紫外光固化油墨 印刷 光引发剂,"概述了国内外紫外光固化油墨的发展进程,分析了紫外光固化油墨的成膜原理及其组成,并对紫外光固化油墨的特点和应用进行了阐述。综述了影响紫外光固化油墨性能的因素,并指出了紫外光固化油墨目前存在的问题和今后的发展方向。"
快速成型 喷墨 UV固化 化学芯片 模拟,本文以粘性流体力学多相流体力学和快速成型技术为理论基础研究了可用于化学芯片制造微尺寸快速装药的喷墨快速成型技术该技术工艺结合了光固化成型工艺和喷墨三维打印成型技术利用光固化树脂固化和喷墨喷涂原理把含能材料配制成紫外光UV固化油墨按照原型层片数据经喷头的喷洒在紫外光照射下快速固化成型该系统主要由UV光源三维成型平台成型控制系统喷头和喷洒作用机构五部分构成主要研究内容包括喷墨快速成型系统的建立成型喷头的优化设计成型工艺参数的选择和成型结果分析通过ANSYS软件FLOTRANCFD流体模拟分析喷头设计UV光源选择流体理论计算UV光固化树脂的配制固体颗粒的选取喷射实验和喷墨成型实验开展理论和实验研究研究内容及结果如下1建立了UV喷墨快速成型实验装置2配制出3种性能良好的光固化树脂具有低粘度低气味固化附着好的优点3在陶瓷基片和玻璃基片上进行了线条喷墨快速成型实验表明陶瓷基片上的附着力较好4获得了一系列适合于化学芯片喷墨快速成型的工艺参数喷口喷洒速度涂层厚度光照时间颗粒度固含量等5分析影响油墨固化的因素总结得出了适合大颗粒UV油墨的固化经验公式6分析了加入固体颗粒对光固化反应速度的影响实验表明颗粒度为75μm和02μm的两种颗粒成型效果不好7结合实验表明文中建立的ANSYS微流体模型在低载荷下与实验基本吻合在高载荷下产生失真
有机颜料黄109 联苯胺黄G 二氧化硅 二氧化钛 层层自组装 溶胶-凝胶法 耐候性 耐酸性 润湿性,有机颜料具有着色力强色泽鲜艳色谱齐全等优点已经广泛地应用于油墨涂料塑料和橡胶等的着色而且是近期聚合物着色剂研究开发的热点但多数有机颜料品种存在着水相分散性差和耐光牢度耐候性不好等缺点文献中曾采用聚合物包膜有机颜料包核表面活性剂处理等方法来改善有机颜料的性能但到目前为止仍不尽理想本论文则采用层层自组装技术和溶胶凝胶法对有机颜料颗粒表面进行了二氧化硅二氧化钛等纳米无机氧化物的包覆改性试图将无机纳米氧化物的紫外屏蔽特性高耐候性亲水性化学惰性等优点赋予有机颜料从而提高有机颜料在水相中的分散性耐候性以及耐酸碱性等性能同时又不牺牲有机颜料的高装饰特性因为纳米无机氧化物具有可见光透过特性本论文选用有机颜料黄109和联苯胺黄G作为有机颜料体系研究内容包括纳米二氧化硅胶体粒子在有机颜料颗粒表面的层层自组装包覆二氧化硅纳米薄膜在有机颜料颗粒表面的溶胶凝胶包覆二氧化钛纳米薄膜在有机颜料颗粒表面的溶胶凝胶包覆以及包覆改性后有机颜料的性能研究等关于纳米二氧化硅胶体粒子在有机颜料颗粒表面的层层自组装包覆研究方面首先采用聚电解质聚二烯丙基二甲基氯化铵PDADMAC和聚4苯乙烯磺酸钠PSS交替吸附处理有机颜料颗粒表面使其带上正电荷再通过静电作用将纳米胶体二氧化硅粒子吸附到有机颜料颗粒表面上研究结果表明纳米二氧化硅粒子通过层层自组装方法可以成功地包覆到有机颜料颗粒的表面而且吸附到有机颜料颗粒表面上纳米二氧化硅的量随着预吸附聚电解质层数的增加而增加但当吸附六层聚电解质以后进一步增加聚电解质吸附层数对增加纳米二氧化硅吸附量没有太大意义包覆到有机颜料黄109颗粒表面二氧化硅层的厚度可以通过吸附多层纳米二氧化硅来控制表面元素分析结果表明有机颜料颗粒表面的纳米二氧化硅粒子包覆率随着纳米二氧化硅包覆层厚度增加而增大接触角的实验结果表明包覆了纳米二氧化硅的有机颜料的润湿性发生了明显的改善可以完全被水浸润能够很方便地应用于水性体系中紫外可见光谱分析结果证明了包覆纳米二氧化硅的有机颜料紫外屏蔽性能大大加强在二氧化硅纳米薄膜在有机颜料表面的溶胶凝胶包覆方法方面首先也是利用上述的两种聚电解质对有机颜料颗粒表面进行改性使其表面带上一定量的正电荷之后将带一定正电荷的有机颜料颗粒转移到乙醇溶液中然后将前驱体正硅酸乙酯TEOS和氨水加入到该体系中进行反应透射电镜照片结果表明在表面活性剂聚乙烯吡咯烷酮PVP辅助作用下通过控制氨水和水的用量可以控制包覆到有机颜料颗粒表面二氧化硅的形态使水解和缩合的TEOS能够在有机颜料黄109颗粒表面形成一层致密的二氧化硅纳米级厚度的膜二氧化硅层的厚度可以通过控制TEOS的用量来调控XPS分析结果表明随着二氧化硅层厚度的增加硅含量同样增加氯元素含量降低表明二氧化硅包覆层愈来愈致密紫外可见漫反射光谱数据表明用这种方法包覆的二氧化硅同样可以屏蔽紫外线热分析结果表明包覆了二氧化硅的有机颜料的热稳定性有所提高在二氧化钛纳米薄膜在有机颜料表面的溶胶凝胶包覆方法方面以钛酸正丁酯TBOT为前驱体采用类似于溶胶凝胶法二氧化硅包覆有机颜料工艺成功实现了二氧化钛在有机颜料颗粒表面的包覆研究结果表明可通过调节TBOT的滴加速度水和氨水的加入量等工艺参数得到致密的二氧化钛包覆层二氧化钛包覆层的厚度可通过TBOT的加入量来控制XPS测试结果表明随着二氧化钛层厚度的增加改性后颜料颗粒表面钛元素的含量也是逐渐增加的紫外可见漫反射光谱分析结果表明包覆二氧化钛后的有机颜料的紫外屏蔽性能大大加强与纳米二氧化硅粒子包覆有机颜料的紫外屏蔽性能相类似优于二氧化硅溶胶凝胶法包覆的有机颜料有机颜料包覆二氧化钛后耐热性也有一定程度的提高在改性后有机颜料的性能方面研究结果表明纳米无机物改性后的联苯胺黄G润湿性能都有所改善但用层层自组装方法制备的二氧化硅包覆联苯胺黄G的润湿性能明显优于溶胶凝胶法制备的二氧化硅二氧化钛包覆的联苯胺黄G不管用什么方法进行无机物包覆改性后的颜料耐酸碱性都增强将改性后的联苯胺黄G色浆加入乳胶漆配制成水性建筑涂料进行涂层性能测试发现包覆到联苯胺黄G上的无机物的壳层越厚越致密则改性后的联苯胺黄G配成的涂料涂层颜色就越鲜艳纳米无机物包覆后颜料的耐候性都有提高
水性聚氨酯 异氰酸酯 傅立叶红外光谱 环氧树脂 改性,以前由于市场需要传统的溶剂型涂料由于其良好的综合力学性能和表面性能一直受到广泛应用近年来许多国家相继颁发了有关控制挥发性有机化合物VOC的法令在这种背景下水性涂料得到了迅猛的发展其中水性聚氨酯涂料由于其使用性能的优异受到了广泛的关注及重视由于水相的引入与溶剂型聚氨酯涂料相比对水性聚氨酯的制造具有更高的难度国外对水性聚氨酯的研究近年来取得了迅猛的发展对水性聚氨酯的制造和其化学行为提出了许多新的见解国外的厂家采用了脂肪族异氰酸酯为主要原料制备出了性能优良的水性聚氨酯涂料国内我们主要以芳香族的异氰酸酯如甲苯二异氰酸酯为原料相关理论和生产均处在起步阶段本课题采用甲苯二异氰酸酯聚醚二元醇和二羟甲基丙酸为主要合成原料进行预聚然后在水中分散乳化得到自乳化水性聚氨酯对其制备工艺进行了初步探索确定了合理的工艺条件本实验系统地研究了亲水单体二羟甲基丙酸的含量扩链剂的含量NCOOH投料比等对预聚物的黏度以及对其涂膜的拉伸强度延伸率剪切强度和耐水性的影响所得的水性聚氨酯贮存稳定性能良好通过傅立叶红外光谱表征说明了聚氨酯分子链中存在氢键其硬段的存在使聚氨酯具有优良的拉伸强度而软段则赋予聚氨酯优良的柔韧性能在制备水性聚氨酯基础上引入了环氧树脂制得了环氧改性水性聚氨酯环氧树脂的引入使水性聚氨酯中具有了交联结构与改性前的水性聚氨酯相比其涂膜耐水性耐溶剂性以及机械性能都得到了提高并研究了环氧树脂的引入方法及环氧树脂加入量对分散体及其涂膜性能的影响傅立叶红外光谱分析显示出了环氧树脂与水性聚氨酯之间存在化学键的连接以上实验各项结果显示通过环氧树脂改性取得了预期效果所得产品的综合性能优异
无轴(电子轴) 伺服传动 凹版印刷机 交流伺服电动机,"概述了无轴(电子轴)传动技术在国内外印刷机上的应用现状,并对该技术在凹版印刷机上的应用特点进行了论述,指出我国微电机行业应抓住这一契机,利用行业的优势,研究和开发适用于我国印刷设备需要的交流伺服传动系统。"
水性油墨 油墨市场 发展趋势 印刷机 干燥速度 有限公司 柔性版印刷 包装印刷 稳定剂 印刷油墨,"水性油墨简称为水墨,水性油墨与油性油墨主要区别在于溶剂的不同,水性油墨以水(45%-50%)为溶剂,VOC含量极低,对环境污染小；油性油墨以有机溶剂(甲苯、二甲苯、工业酒精等)为溶剂。在软包装行业,由于溶剂型油墨"
瓦楞纸箱 发展,"客观的介绍了国内外瓦楞纸箱的生产情况,即对未来的发展趋势作了分析。"
植物油墨 大豆油墨,"油墨是印刷行业的主要耗材,根据油墨组分及含量、承印物、用途、印刷设备、印刷方式和使用方法等可分为多个种类。现有的多数油墨中大多都要含有有机(或无机)溶剂、颜料等,不符合环保绿色印刷的要求。现如今,"
光固化 UV固化涂料 水性树脂 光引发剂 低聚物,"水性光固化涂料是一种新型的光固化涂料,本文简述了其特点、水性UV树脂、水性光引发剂和水性光固化涂料的应用及研究进展。"
水基油墨印刷纸 碎解pH值 油墨再沉积 浮选脱墨,"介绍了水基油墨印刷纸碎解浆料脱墨困难的主要原因,分析了影响水基油墨再沉积的因素。结果表明,碎解pH值和循环用水的油墨积累对油墨再沉积有很大影响。"
油桐 桐油 生物质能源 利用,"油桐是原产我国的世界著名的工业油料树种。油桐在我国16个省、市、自治区有栽培分布,栽培分布范围广,品种资源丰富,结实早,产量高。简单介绍了油桐的资源分布、栽培与利用及其栽培的优势,并提出把油桐生产列入国家生物质能源发展的范畴、把油桐生产列入“十一五”规划项目、开展油桐作为生物柴油使用的试验研究、恢复原来的油桐研究会、迅速搜集保存油桐种质资源等建议。"
