印刷线条 感知质量 模糊神经网络 机器视觉 综合评价,"线条质量作为印刷品质量评价的主要内容之一,长期以来采用视觉主观评价方法,具有主观性、不一致性、效率低等问题。数字印刷领域虽然已开始采用机器视觉技术开展印刷线条质量的客观指标检测,但还不能明确给出这些客观测量值与线条整体感知质量之间的关系描述。对多组具有不同的模糊度和粗糙度边缘特征、不同的暗度和对比度表现、不同的线宽复制误差和填充效果的印刷线条开展实验研究,通过对线条质量属性的客观测量值与线条主观感知质量评价分值之间的数据分析,利用模糊神经网络算法建立了线条质量属性与主观感知评价结果之间的关系模型。实验结果表明,印刷线条感知质量的评价建模应以ISO13660标准提出的6个线条质量属性为依据,任何一个属性都不能唯一地确定印刷线条的质量,同时也都不应该从综合评价中删除出去;所提出的印刷线条感知质量评价建模方法是有效可行的,评价模型的预测结果与主观评价结果间具有很好的一致性,为印刷线条质量属性的客观检测赋予现实意义,也为基于机器视觉的印刷线条感知质量的综合评价提供了理论依据。"
绿色印刷 印刷企业 江西省 产品认证 产业政策 印刷产品 印刷协会 社会责任感 原辅材料 职业技能,"目前,国家已经出台了不少宏观的印刷产业政策,但真正利好企业推行绿色印刷的微观政策却还没有到位。绿色印刷的推行,在我国起步较晚,只不过四年的时间,但是力度大、发展快,似已成燎原之势,点亮中华大地。江西,作为绿色大潮中的一簇,也在大力推行绿色印刷,任重而道远。绿色路,在脚下为了绿色印刷在江西的""渲染"",从江西省印刷协会到江西省各印刷企业,都做出了自己的努力。"
绿色印刷 印刷企业 新闻出版 绿色化 方式转变 绿色认证 节约资源 质量效益 经济发展问题 中小学教材,"2013年3月李克强总理在广东等省考察经济发展问题时强调,鉴于目前国内外经济发展的困难和问题,中国经济必然要在发展方式转变上打造""升级版""。""升级版""的简明含义就是要追求有质量效益的速度。实施绿色印刷就是印刷业打造本行业发展方式转变上的""升级版""。印刷企业理应积极"
绿色印刷 包装设计 应用发展,"绿色印刷始于上个世纪80年代,绿色印刷在美国、日本、德国的运用距今已有近30年的历史,绿色印刷已从概念讨论阶段发展到实际应用阶段。经过这么多年的发展,绿色印刷无论是从印刷理念、技艺标准、工艺、原材料等方面还是在印刷科技手段方面都有了极大的进步和发展。目前,我国绿色印刷的发展还处在初始阶段,本文期望通过对绿色印刷的研究,加强对绿色印刷的认知程度,为努力发展绿色印刷进行有益探索。"
绿色印刷 防伪印刷 印刷企业 商业票据印刷 印刷品 主要体现 展望 产业结构调整 现状 重要措施,"在国家新闻出版业""十二五""发展规划中,将实施绿色印刷作为印刷产业结构调整、转型发展的一项重要措施。在绿色印刷如火如荼的进行中,那么,绿色印刷到底有多""绿""?本文主要介绍其现状及展望。一、绿色防伪印刷的总体现状绿色防伪印刷主要指商业票据印刷。商业票据印刷是关系到金融、税收安全,国家乃至全球经济秩序的重要行业,是中国印刷业的特殊领域,其发展受到党和国家的高度重视。当前,传统商业票据广泛使用新技术,主要体现两个方面:一是商业票据的数字信息更丰"
绿色印刷 行业协会,"印刷行业协会在推进我国绿色印刷产业发展中发挥着重要作用。目前我国印刷行业协会还存在着宣传覆盖面不够广、推进形成绿色印刷包装产业网络关系的力度不够等问题,需要从推进市场环境建设、组织绿色印刷产业联盟、协调绿色印刷产业链等方面进一步发挥行业协会的指导、协调和服务作用。"
绿色印刷 转型 现状 标准 政策,"2012年11月,党的十八大报告明确了将政治建设、经济建设、文化建设、社会建设的四位一体建设增加为包含生态文明建设的五位一体建设。绿色印刷作为生态文明建设的组成部分,已经成为今后一段时期印刷业转型发展的必然选择。一、充分理解绿色印刷的基本含义绿色印刷是指采用环保材料和"
绿色印刷 印刷企业 框架设计 发展战略 印刷业 保护环境 节约资源 印刷发展 调整产业结构 印刷设备,"今年以来,中国中东部地区持续的大范围雾霾天气造成空气重度污染,给公众的健康带来了极大的危害,也严重影响了人们的正常生活。生态环境已成为广大人民群众非常关心的问题。党的十八大报告指出,我们要坚持节约资源和保护环境的基本国策,形成节约资源和保护环境的产业结构、生产方式、生活方式,从源头上扭转生态环境恶化趋势。十八大报告提出的"
绿色印刷 发展现状 问题与分析 发展对策,"破坏生态环境、损害人类自身健康的发展模式启示人们必须从可持续发展的角度重新审视人类的生产生活方式。文章围绕印刷品的生产过程,从印刷产业绿色化的角度出发,论述了现阶段国内外绿色印刷发展所采取的措施和取得的成效,着重从理念、需求、成本三个方面分析了中国绿色印刷发展存在的问题,并在此基础上提出了相应的解决对策。"
印刷行业 挥发性有机化合物(VOCs) 排放特征,"采用生产工艺调研,现场采样及实验分析相结合的方法,研究了生产工艺、原辅材料、治理技术及生产管理对制鞋行业VOCs排放的影响,研究了印刷行业VOCs的排放特征。研究表明:印刷行业VOCs主要来源于印刷用油墨及其稀释剂、润版液、清洗剂、胶黏剂等含溶剂产品的使用。印刷工艺和油墨种类是决定印刷企业总VOCs排放浓度的关键因素,水性油墨可显著降低VOCs的含量,目前印刷行业多为无组织排放,治理设施普及率低,存在生产管理不完善等情况。通过研究印刷行业VOCs的排放特征,为制定地区空气质量保障方案做充分的准备,具有十分重要的意义。"
绿色印刷 推广途径 统计调查,"随着国家绿色印刷战略的不断深入推进,绿色印刷受到了越来越多的重视。本文基于问卷调查、数据统计分析,围绕消费者对绿色印刷的认知度和接受度及印刷企业对绿色印刷的重视度和践行度,论述了我国绿色印刷的发展现状,着重从传统观念、宣传、立法三个方面分析了其制约因素,并在此基础上提出了绿色印刷更好的推广方式与途径。"
绿色印刷 标准 认证 建议,"印刷业作为我国的传统产业,其规模已接近全球第二,但印刷过程中的环境问题一直制约着其发展。绿色印刷战略的提出和实施成为解决印刷行业绿色转型的一个突破口。本文介绍了我国绿色印刷战略的起源、政策支撑、实施及其成果,分析了绿色印刷工作开展中面临的问题,并提出相关建议。研究表明,进一步推动我国绿色印刷的政策建议如下:第一,完善绿色印刷标准;第二,加强推进绿色印刷认证工作;第三,提高企业认识、全员参与并将绿色印刷工作落到实处;第四,对获得绿色印刷认证的企业给予政策支持或财政补贴;第五,针对印刷加工全过程中所需纸张、油墨、胶黏剂、润版液、印版等原辅材料,加强各供应链环节的环境保护标准要求和控制。"
新媒体研究 新媒体时代 传播研究转型 新媒体事件 文化社会学,"新媒体时代以来,社会传播现实的变化带动了传播学界的观念变化,促使传统的""媒介—受众""关系研究不断向""新媒介—用户""关系研究转变。新媒体技术诞生的初期,乐观的技术决定论经常占据主导地位,而当新媒体技术扩散和采纳的比例逐渐提高,学者们又总是适时地转向社会塑造论,探讨新媒体技术的应用何以在社会历史情境中产生社会影响,进而推动社会塑造的进程。在中国社会语境下,新媒体事件的传播实践成为中国社会转型过程中一个独特而具有影响力的传播现象,吸引了大批华人传播学者的关注,然而这些研究大多属于个案研究,或以西方理论解释中国情境,未能阐明基于中国新媒体环境的新传播机制究竟如何作用。为此,应将诠释研究范式带来的传播研究的""文化转向""更好地融入新媒体研究中,借用文化社会学的研究方法""深描""新媒体事件在中国社会文化情境中所建构的特殊意义。"
D打印技术 个性化 医用高分子 组织工程,"3D打印技术能够根据不同患者需要,快速精确制备适合不同患者的个性化生物医用高分子材料,并能同时对材料的微观结构进行精确控制.因此,这种新兴的医用高分子材料制备技术在未来生物医学应用(尤其是组织工程应用)中具有独特的优势.近年来,对于3D打印技术制备生物医用高分子材料的研究开发受到了越来越多的关注.不同的生物相容高分子原料被应用于3D打印技术,而这些3D成型高分子材料被用于体外细胞培养,或动物模型的软组织或硬组织修复中.本文主要介绍了近年来3D打印技术在生物医用高分子材料制备中的研究进展,并对该领域的未来应用和挑战进行了展望."
绿色印刷 认证 盛元印务 环保 效益,"随着低碳经济理念的不断深化,发展绿色印刷已经成为印刷行业的发展方向。从字面上理解,绿色印刷是以环保、节能为主题,目前在中国开展的绿色印刷认证对企业提出了更多、更严苛的要求,而事实上笔者认为绿色印刷认证是每个印刷企业都需要去做和努力实现的目标。因为绿色印刷对企业也好,对社会也好,或者说给印刷行业带来的积极影响和意义都是多方面的。下面就来分析一下绿色印刷认证给企业带来的益处。"
绿色印刷 印刷企业 中小学教科书 新闻出版局 青海省 环境标志 上海市 印刷工作 认证工作 山西省,"为进一步了解各地区的绿色印刷推进情况,分享各地区开展绿色印刷的成功经验以及帮助印刷企业抓住机遇,实现绿色转型,在此,本文对近1年来部分地区开展的绿色印刷行动进行了整理。"
绿色印刷 政府采购 票据 票证 发票 印刷企业 基本实现 环保 甘肃 引导,"每日甘肃网2013-12-06报道:日前,环保部发布《关于票据票证实施绿色印刷的通知》,明确从2014年起,各地要引导票据票证印刷企业实施绿色印刷。到""十二五""期末,政府采购的税务发票、财政票据等票据票证将基本实现绿色印刷,同时要引导和鼓励其他各类票据票证逐渐实现绿色印刷。"
绿色印刷 历程 现状 举措 绿色认证,"世界100多年的工业化道路,一直延续着""先污染后治理""的发展模式,先给环境造成严重污染,如伦敦及其他工业城市上空的雾霾,都与工业污染密切相关,然后治理污染就成了刻不容缓的任务。绿色印刷和其他工业的绿色生产一样,不仅关系着印刷产业的健康发展,而且与人类社会的生存发展息息相关,已经引起世人的足够重"
紫外发光二极管 扫描 波长 照度,"近年来随着UV-LED的问世,为印制电路板曝光领域带来革命性的变化。其高效节能、恒定的光照强度、优秀的温度控制、几乎为零的维护成本。促使UV-LED面光源替代传统曝光灯成为发展趋势。文章针对印制电路板阻焊曝光工艺紫外光源的特点,论述了推广应用中需要克服的相关技术及解决方法;并通过实验数据,分析出影响UV-LED面光源曝光均匀性、时间、解析度的因素。实践表明,采用扫描式、混合波长的UV-LED面光源曝光方式,高效节能、光强分布均匀稳定、能够完全满足阻焊曝光过程对光源的指标要求,可操作性强,对印制电路板曝光工艺的品质提升与节能降耗将起到推动作用。"
水性油墨 水性丙烯酸树脂 抗水性 干燥速度,"水性油墨的抗水性和耐酸碱性是直接制约水性油墨应用性能的重要指标,本研究采用甲基丙烯酸甲酯(MM A)、丙烯酸丁酯(BA)为硬软单体,以丙烯酸(AA)、丙烯酸羟丙酯(HPA)为功能单体,采用乳液聚合法制备一种高固含量、耐酸碱性和抗水性优良、成膜性较好的水性丙烯酸树脂,并用这种树脂配制水性油墨;讨论了各单体用量对树脂膜抗水性和耐酸碱性的影响,以及油墨其他相关成分对油墨干燥速度、抗水性和光泽度的影响。研究表明,当MMA:BA质量比为3:2,AA和HPA含量分别为3.6%和6.7%时,树脂获得良好的抗水性;当助溶剂异丙醇含量为5%,分散剂用量为颜料和填料总量的3%,pH值为8.5~9.0,油墨中水的含量为25%时,油墨具备较好的干燥速度、抗水性和光泽度等性能。"
绿色印刷包装 环保油墨 印刷电子 印后加工 按需喷墨,"为了解目前国内有关绿色印刷包装的研究现状,对2008-2012年国内有关环保油墨、印刷电子、印后加工、按需喷墨的文献进行汇总研究,并从文献学的角度对其进行综合分析。研究结果表明,环保油墨和印后加工的文献数量较大,但文献数量增长整体呈下滑趋势;而印刷电子、按需喷墨文献数量虽然远远低于环保油墨和印后加工,但文献数量却增长迅猛。"
大豆油 胶印油墨 植物油脂 环保植物 印刷企业 挥发性有机化合物 挥发性有机污染物 绿色环保型 绿色化 油基油墨,"近年来,随着绿色环保印刷的呼声日益高涨,各个印刷企业都在实施绿色环保措施。油墨作为印刷行业的主要耗材,其绿色环保受到人们的密切关注。尤其挥发性有机污染物(VOC)减排与控制技术创新联盟的成立对油墨的绿色技术提出更高的要求。而环保植物油墨(大豆油墨)作为环保油墨中的佼佼者它不仅绿色环保,还加速了我国印刷行业绿色化前进的步伐。"
油墨 安全标准 环保标准 保存期 创新 同类 研发 玩具 经验 生产商,"·爱克发超过140年经验创新,1992年开始油墨研发;·通过全球ISO环保标准ISO 9001:2000及ISO 14001:2004:·通过全球玩具安全标准(EN 71-3:及ASTM F963-96a)·气味接近零,为同类UV油墨中最轻;保存期达18个月,为同类UV由墨中最长;"
导电油墨 电子市场 印刷 应用市场 市场规模 经济危机 咨询公司 研发 新产品 预测值,"2008～2009年的经济危机几乎对所有行业造成冲击,甚至以研发为主推力的导电油墨和印刷电子市场也未能幸免。即使这样,我们还是欣喜地看到在导电油墨和印刷电子市场上仍有许多新公司成立,且各公司不断加大研发力度,并在2010年陆续推出新产品。2011年,这种趋势还在持续。据知名咨询公司IDTechEx预测:2026年,印刷电子市场规模将达到3000亿美元。即使市场规模仅达到预测值的一半,也意味着该领域具有巨大的市场商机。印刷电子成为导电油墨又一主要应用市场"
纸张印刷适性 综合评价 预测 光谱表征 自定义纸张特性文件 色彩算法自动选择,目前全球造纸工业的大宗消费领域是印刷行业纸张成本占到印刷总成本的6070纸张印刷适性是决定其印刷过程和质量的重要因素揭示纸张性能与印刷品质量之间的作用机理是造纸和印刷行业尤为突出的问题然而由于纸张性能印刷之间复杂的多元关系以及影响因素的不确定性该技术难题尚未能较好突破本课题以不同印刷适性纸张为分析对象评判纸张相关性能对其响应印效指标的影响程度量化两体系之间的多元非线性作用规律从纸张相关性能有效组合角度出发研究纸张印刷适性的综合质量评价模型推导纸张性能综合和印刷品质量综合的数学表达式探索两者的关联构建纸张印刷适性的预测方程基于光谱传输特性实现测试纸张与参考纸张之间的印刷适性匹配和评估并推导待印刷纸张的光谱表征模型创建自定义的纸张特性文件揭示不同印刷适性纸张与目标印品阶调色彩传输的作用机理并开发其应用模块针对色域边界色域映射再现意图三个色彩复制关键技术分别提出新的算法并研究根据不同印刷适性纸张的复制特征自动选择适合应用策略机制且编制软件程序本课题量化了纸张在印刷中的行为和作用规律旨在为纸张匹配适宜印刷条件提供科学依据形成纸张应用与印刷实践控制的系统理论指导推动我国造纸与印刷技术的高质量生产和针对性应用利用灰关联分析研究纸张相关性能对印刷品质量的影响程度将各性能进行综合排序结果表明铜版纸性能影响力从大到小依次为平滑度匀度指数光泽度白度吸墨性表面强度不透明度胶版纸依次为吸墨性匀度指数光泽度白度不透明度表面强度平滑度轻涂纸依次为平滑度吸墨性白度匀度指数光泽度不透明度表面强度继而选择影响程度最大的前三个纸张性能作为自变量以响应的印品质量指标为因变量建立两者之间作用规律的多元非线性回归模型以此可以寻求最佳纸张性能组合获得预期印刷效果将纸张相关性能指标有效组合可以对纸张质量进行更准确的判断选取6个纸张性能作为输入层纸张综合评价级别值作为输出值构建纸张RBF神经网络综合评价模型结果表明该模型符合实践应用且精度比BP神经网络更高但纸张评价值范围仅为123为了进行更细致的比较提出基于人工鱼群投影寻踪算法的纸张质量综合分析模型建立纸张评价等级与投影值之间的关系式计算出的纸张评价值范围可为任意实数可比性更高尤其适合于同等级纸张的比较利用主成分分析法分别得到纸张性能综合和印刷品质量综合的计算表达式然后以具体纸张性能综合值为自变量以印品质量综合值为因变量拟合两体系之间的关系曲线最终得出纸张印刷适性的预测方程其自变量通过纸张性能综合表达式被转换成纸张相关性能该方案将纸张和印刷结合起来获取信息更全面应用方便结果客观具体基于光谱传输特性提出四种方案实现测试纸张与参考纸张之间的印刷适性评估包括朗伯比尔光谱定律KubelkaMunk光谱模型纽介堡光谱方程主成分分析法结果表明主成分分析法光谱评估效果最好但计算量最复杂纽介堡光谱方程评估效果和计算量均次之朗伯比尔光谱定律和KubelkaMunk光谱模型评估效果最差但计算量最小进一步将高品质的纸张视为朗伯六界面体分解为三个部分再进行组合推导出纸张的全反射率全透射率新模型使得在各种测量几何条件下表征纸张的光谱特性更简单直接提出并建立自定义的纸张特性文件使印刷所用的纸张和油墨能更好地相适应和匹配纸张特性文件的核心建立步骤是印刷设备的基本线性化最适合油墨色彩数量的判定判断最大油墨厚度并给出油墨量建议利用VC软件进行上述步骤编程使其能够在色彩管理系统中进行调用应用于实际印刷系统中利用曲面细分技术计算色域球体边界的三角形近似值将凸壳算法非空区域最大值点的γ02提出基于分区最大边界法和凸壳算法的组合方案色域边界新算法结果表明组合算法精度和计算量均介于分区最大边界法和凸壳算法之间基于遗传算法提出色域映射的新方法将图像超色域颜色的CIELAB色彩空间坐标定义为基因适应度函数定义为原始图像和映射图像的SCIELAB色差的倒数实行单点交叉或多点交叉结果表明遗传算法色域映射方案比传统裁切算法的色差要小针对四种再现意图对其各自特点及适用范围进行实验和规律总结最后分析纸张各性能与再现意图色域边界算法及色域映射方法的关系研究得出根据纸张相关性能自动选择各种色彩具体算法的规律和方案流程并利用VC软件实现自动选择功能
,"UV油墨非常适合于玻璃产品的印刷,但其耐水性不佳,一直困扰着国内外油墨研发者,也阻碍了UV油墨在玻璃上的推广应用。针对这一情况,伊藤油墨涂料化工技研株式会社总结多年UV油墨研发经验和教训,突破传统思路,最新开发出一款耐水煮UV丝印玻璃油墨N-GL9000,其特点如下:(1)极佳的耐水性。UV固化好的玻璃产品,能经得起自来水浸泡30 d以上,再用开水浸泡24 h,固化膜硬度和附着力不受影响。(2)UV快速固化,无需后加热处理。新型UV玻璃油墨印刷后,直接UV固化,不需要后加热处理,就能赋予墨层极佳的耐水性能。"
,"酒瓶贴花用途的低温水转印花纸是近年来为适印低能耗、环保及美观的要求而开发的水转印花纸产品。通常这类花纸都是由溶剂挥发型油墨进行印刷,因此印刷环境较为恶劣,生产效率也较低。为改变这种状况,目前国内已有油墨生产厂家着手研发环保和印刷效率更高的UV固化型油墨。本文就杭州恒基油墨涂料有限公司研发和生产的酒瓶用花纸印刷的UV系列油墨作一简单的介绍。"
绿色设计理念 食品包装 可持续性 环保,现代科学技术的革新既给社会生产力带来了突飞猛进的发展为人类创造了巨大的物质财富又对生态环境造成了前所未有的破坏一场绿色革命浪潮正在席卷全球将绿色设计理念运用于食品包装设计中是顺应世界绿色文明发展的趋势将对人类及其居住环境起到重要作用本文以绿色设计理念为引线了解认知运用绿色包装设计的理念对食品包装的材料结构以及视觉元素进行适度健康可回收的绿色效能研究以绿色设计理念为指导的绿色食品包装主要是探究包装的可持续性即保护生态环境的效率提高包装生态环境的协调性减轻包装对环境产生的负荷与冲击力具体地说就是节省材料减少废弃物节省资源和能源易于回收利用和再循环包装材料能自行分解不污染环境不造成公害食品包装可持续性的意义主要在于加强对包装生产的管理和包装废弃物的回收处理目前世界公认包装的三种作用变得越来越明显即包装在经济发展中的中心性包装的环境保护责任性和致力于改善人类生存条件的技术创新性绿色包装的目标就是要以保存最大限度的自然资源形成最小数量的废弃物和最低限度的环境污染本文在探究绿色理念的过程中深刻感受到绿色包装设计已经不仅仅是一句时髦的口号而是切切实实关系到每一个人切身利益的事情当今世界各国进入市场的商品中已经有众多利用高科技手段完成的绿色包装设计成果出现如无菌纸盒包装可降解塑料包装可食用包装材料有机生物包装材料等食品包装设计由豪华向节俭由污染向环保着眼于人与自然的生态平衡关系还地球一个绿色的空间这已成为必然的发展趋势
,"近日,伊藤油墨涂料化工技研株式会社总结多年UV油墨研发经验开发出一款耐水煮UV玻璃油墨N-GL9000。这种新型UV油墨有以下几个特点:一是极佳的耐水性。经过UV油墨固化好的玻璃产品,能经得起自来水浸泡30天以上,并且固化膜硬度和附着力均不受影响。二是这种UV油墨固化快,无需加热处"
绿色印刷包装 专利 按需喷墨 印后,"为了及时了解国际上绿色印刷包装产业技术最新研究进展和发展态势,选取了绿色印刷包装产业4个主要领域——印刷电子、油墨、按需喷墨、印后,进行了德温特专利数据库的主题检索和分析,对国内外关于绿色印刷包装产业的技术研发和知识产权进展态势进行了梳理和总结。结果表明,中国在绿色印刷包装业技术研发领域势头较好,后劲较大。"
热喷墨 压电喷墨 相变喷墨 驱动脉冲,"热喷墨、压电喷墨和相变喷墨印刷以不同的方式发生并喷射墨滴,在打印头的驱动方法上必然存在各自的特点。为了更好地应用喷墨设备,应该对目前商业市场上的三种主要按需喷墨技术的驱动脉冲差异有相当程度的了解。"
