水性柔印油墨 树脂 分散性 耐摩擦性 抗划伤性,水性油墨不含挥发性有机溶剂绿色环保低抗划伤高耐磨性水性彩色柔印油墨是应用于即开型有奖票据印刷中的一种环保型功能性油墨即开票的印刷工艺是在卡纸上采用柔印的方式先后印刷黑白色打底墨各两层然后通过喷码机喷涂有奖信息再用柔版印刷方式印刷UV隔离油经过紫外灯固化后先后再印刷黑白遮盖墨各两层最后在遮盖墨上印刷彩色水性油墨这里的彩色水性油墨就要求具有低抗划伤性和高耐摩擦性目前应用于即开票印刷的柔性版水性彩色柔印油墨虽说我国已经开始研制和生产但性能上依然不是很理想仍大多依靠进口随着彩票票据业的逐步发展即开型票据的市场份额也在不断扩大低抗划伤高耐磨性水性彩色柔印油墨具有较广阔的市场前景对此种水性彩色柔印油墨的研发也就具有十分重要的意义本论文根据国内外水性柔印油墨的研究现状研发一种适用于彩票印刷的四色水性彩色柔印油墨通过改变研磨树脂的种类颜基比分散剂的种类及含量研磨时间和研磨设备等探讨了油墨分散性的影响因素为了得到低抗划伤高耐磨性水性彩色柔印油墨通过改变颜料及连结料的种类和含量助剂的种类及含量配制油墨测试油墨的印刷适性使用印刷适性仪IGTF1进行打样测试样张的光泽度密度耐摩擦性和抗划伤性等研究了水性油墨体系中各组分对油墨性能影响最后通过优化水性柔印油墨的配方最终制备出具有高耐摩擦性低抗划伤性的水性柔印油墨研究结果表明油墨的颜基比颜料成膜树脂助剂的种类以及含量是影响水性油墨性能的主要因素流平剂和蜡乳液含量对油墨的耐摩擦和抗划伤性有重要的影响四色油墨均选用研磨树脂YM1研磨2h分散性最好青油墨选用酞青蓝Pb154颜基比为31分散剂选用750760为21分散剂在基墨中的质量分数为1制备的油墨分散性能最好成墨中颜料含量为174成膜树脂选用7762411流平剂B4为1蜡乳液L1为0时配制的油墨为最佳黄油墨选用联苯胺黄颜基比为11分散剂选用750760为11分散剂在基墨中的质量分数为06得出的油墨的分散性能最好成墨中联苯胺黄颜料含量为16成膜树脂选用907711水流平剂B4为05蜡乳液L1为25时配制的油墨为最佳品红油墨选用永固桃红FBB颜基比为21分散剂选用750760为11分散剂在基墨中的质量分数为1得出的油墨的分散性能最好成墨中颜料含量为96成膜树脂选用6249011水流平剂B4为15蜡乳液L1为2时配制的油墨为最佳黑色油墨选用卡博特炭黑颜料颜基比为31分散剂选用75076012分散剂在基墨中的含量为1得出的黑色油墨的分散性能最好的成膜树脂选用6249077111水流平剂B4为2蜡乳液L1为25时配制的油墨为最佳
包装印刷 喷码技术 药监码 二维码,"背景国内喷码形式的个性化包装,一个里程碑式的开端是2007年12月4日国家质检总局发布了《关于贯彻国务院关于加强食品等产品安全监督管理的特别规定实施产品质量电子监管的通知》(国质检质联〔2007〕582号)。通知要求,在2008年6月底前对9大类69种重点产品全面实施电子监管,所有产品加贴电子监管码才能上市。电子监管码与商品条码有着本"
水基凹印油墨 丙烯酸酯乳液 改性 印刷适性 附着牢度,作为一种新型绿色环保的印刷材料水基凹印油墨已经成为凹版印刷油墨的重要发展方向目前水基凹印油墨已广泛应用于纸基类印刷品印刷但在塑料类基材印刷品上由于附着牢度差等问题水基凹印油墨的应用和发展受到阻碍本课题立足于通过对水基凹印油墨的主要成膜物质丙烯酸酯乳液进行改性并以改性后丙烯酸酯乳液为主要原料制备能适用于塑料基材的印刷性附着性等综合性能优良的水基凹印油墨在丙烯酸酯乳液的改性研究中采用无皂半连续种子乳液聚合法以甲基丙烯酸甲酯MMA丙烯酸丁酯BA为主单体丙烯酸六氟丁酯G01为功能单体合成了具有核壳结构的丙烯酸酯乳液以单体转化率凝胶率稳定性等为主要指标考察了乳化剂2丙烯酰胺基2甲基丙烷磺酸钠盐AMPSNa引发剂过硫酸钾KPS反应温度等因素对丙烯酸酯乳液聚合反应体系的影响以附着牢度为主要指标考察了功能单体用量交联单体种类及其用量对改性后丙烯酸酯乳胶膜性能的影响实验结果表明当乳化剂用量为3引发剂用量为06功能单体用量为15交联单体GMA用量为3聚合温度为80C时改性后所得丙烯酸酯乳液的体系较为稳定其乳胶膜的附着牢度较好通过对改性后丙烯酸酯胶膜的FTIR分析可知在618cm1和690cm1处出现CF键吸收峰且在1650cm1处没有CC吸收峰说明主单体功能单体等全部单体都参与了乳液聚合通过对改性后丙烯酸酯乳液的TEM分析可知乳液乳胶粒子具有明显的核壳结构粒径在90nm左右且分布较窄在水基凹印油墨印刷适性的研究中采用正交试验法以附着牢度粘度初干性和着色力为主要指标考察了改性丙烯酸酯乳液助溶剂水溶性丙烯酸树脂颜料等因素对油墨印刷适性影响的主次因素结果表明改性丙烯酸酯乳液水溶性丙烯酸树脂对油墨附着牢度影响显著助溶剂水溶性丙烯酸树脂对油墨粘度和初干性影响显著颜料对油墨着色力影响显著综合分析确定油墨各组分的较优组合为A4B2C2D2并经重复性实验确定了油墨各组分的最佳配比为改性丙烯酸酯乳液5660助溶剂913水溶性丙烯酸树脂2225颜料炭黑912助剂34所得水基凹印油墨的颜色细度粘度着色力和附着牢度均达到GBT263942011的要求
数字印刷 喷墨技术 数据驱动 Stream技术,"喷墨印刷是一种新的无接触、无压力、无印版的印刷技术,将图像信息光栅化后输入喷墨打印机即可实现打印。按喷墨介质可以分为固体喷墨和液体喷墨两种。固体喷墨主要为染料热升华,成本较高;液体喷墨中的热发泡式和压电式,是办公打印产品的主流技术。液体喷墨打印的Stream技术可实现胶印级的品质、产能和成本,广泛运用于工业喷墨印刷,至今全"
数字印刷 生产型 喷墨印刷机 解决方案 喷墨打印头 专业文章 彩色喷墨印刷 可变数据印刷 印刷业 工作流程,"生产型喷墨系统在未来印刷业中将是一股强劲的力量。长期以来,数字印刷平台展现了许多优势,如更符合成本效益的短版印刷、可变数据印刷等。在过去几年中,伴随着大量新玩家的涌入,高速喷墨解决方案逐渐成为人们关注的焦点。除了新型和改进型产品的竞争力得到提升外,介质、印后加工以及工作流程提供商的发展也推动了该项技术的发展和应用。"
云印刷 出版印刷增值 移动互联网,"众所周知,移动互联网的出现冲击了出版印刷,而""云印刷""则是反过来利用移动互联网来实现印刷的增值。所谓云印刷,是指基于云计算商业模式应用的印刷加工、印刷管理、印刷云平台的总称。云印刷有4个构成要素,即终端设备的应用程序(用于发送印刷任务),云印刷服务网络(用于传递印刷任务),印刷生产设备(用于执行并完成印刷任务),及物流服务(用于配送印刷产品)。云印刷的过程涵盖了产品征订、生产、物流配送等方面,一般可分为4个步骤:(1)客户提交上传印刷任务至印刷服务网络;(2)印刷服务网"
微流控纸芯片 微加工 检测技术 应用,"微流控纸芯片是一种新兴的微流控分析技术平台,具有成本低、加工简易、使用和携带方便等优点,在临床诊断、食品质量控制和环境监测等应用领域具有很大的应用前景,近年来,引起广大科学工作者极大的兴趣。本文着重介绍目前文献相继报道的各种纸芯片加工技术,包括紫外光刻、蜡印、等离子体处理、喷墨打印、喷墨溶剂刻蚀、绘图、柔印和激光光刻等技术。此外,还介绍了微流控纸芯片分析中的检测方法及其应用。"
数字印刷机 传统印刷 电子油墨 印刷方式 可变数据印刷 纸张 承印物 个性化印刷 印刷技术 图文信息,"数字印刷是使用数字文件控制相应设备,将呈色剂/色料(如油墨)直接转移到承印物上的复制过程。即是由数字方法获取的图文信息经计算机处理后的电子文件直接成像于橡皮布、版材或纸张,而无须输出菲林和人工拼晒版的有别于传统印刷的全新印刷方式。从技术上看,数字印刷特点是印刷制版时间短,可以更经济的印刷短版业务,可以做到""一张起印""。"
水性丙烯酸酯树脂 ADH/DAAM 低温自交联 水性PE/PP油墨,近年来环境污染严重各国已制定相关环境保护法规以限制VOCs的排放食品儿童玩具和医疗等包装与人类关系密切这些方面一些发达国家已采用水性油墨替代溶剂型油墨针对PEPP薄膜的低极性和高温易卷曲变形等不足开发了低温自交联型水性丙烯酸酯树脂作为水性油墨连接料既可满足涂膜的低温60交联反应还使水性油墨具备环保无污染光泽度和交联度高以及附着力耐水和耐溶剂性好等优点本论文以AIBN为引发剂MMA为硬单体BA为软单体AAHPA和DAAM为功能性单体采用自由基溶液聚合法合成丙烯酸酯树脂再用碱中和水性化得到阴离子型低温自交联水性丙烯酸酯树脂研究了树脂配方合成工艺等对树脂水溶性树脂涂膜性能等的影响并得到优化的树脂配方和合成工艺研究发现当AIBN为单体用量的2DAAM占单体用量的2AA占单体用量的92HPA占单体用量的58单体占聚合反应物质量的40溶剂PMADMF21质量比单体滴加时间为3h反应保温时间为4h时得到转化率为992的水溶稳定性好的丙烯酸酯树脂通过树脂发生固化交联前后涂膜性能的对比发现交联固化后的树脂涂膜Tg明显提高硬度提高随着DAAM用量的增大树脂的Tg变化不明显涂膜的交联度提高当DAAM的用量为2ADH与DAAM的质量比为08时涂膜交联度为8835吸水率为1028硬度达2H性能明显优于固化反应前的涂膜性能傅里叶红外光谱FTIR和差示扫描热分析DSC一致表明DAAM与ADH在低温60下发生了交联反应以自制的低温60自交联水性丙烯酸酯树脂为连接料制备了水性油墨并与市场上不同类型的连接料配制的油墨进行了性能对比本实验所制备的水性树脂与水性色浆的配比为6520时油墨涂膜在PEPP薄膜上的着色力为100附着力为1级光泽度为89具有良好的耐折性抗粘连性和耐干摩擦性性能达到或者优于市场上同类产品性能
绿色印刷;印刷杂志;绿色发展;印刷有限公司;知度;采购行为;新疆新华印刷厂;消费态度;原辅材料价格;公众环保意识;,"2014年5月,中国印刷技术协会及中国印刷杂志社在全国范围内启动了第二次中国绿色印刷企业调查活动。本次调查围绕""绿色印刷原辅材料""这个中心,内容涉及到企业在绿色印刷原辅材料使用情况、认知度、消费态度、采购行为习惯等,为中国绿色印刷实施工作提供了重要依据。绿色发展是行业必由之路,绿色发展离不开绿色原辅材料。实施绿色印刷,印刷企业应在印刷材料、工艺、环境三个方面下功夫,而真正生产符合环保要求、无污染的绿色印刷产品,采用绿色环保的原辅材料至关重要。从本次按受调查的400余"
绿色印刷 生态环境 健康,"随着科技不断创新,社会不断进步,人们对生态、生存环境认识的不断改变,被国际社会所公认的污染生态环境、危害人类身体健康的传统印刷逐步被新兴技术所取代,取而代之的绿色印刷已成为印刷业发展的主流趋势。而如何落实并实施绿色印刷目标,目前还缺乏制度、标准等强有力的管理措施和手段。本文作者从企业实际发展现状及绿色印刷发展现状出发,分析绿色印刷发展过程中存在的问题,提出个人的几点见解。"
绿色印刷 印刷企业 印刷业未来 新闻出版 可持续发展理念 绿色标准 生命周期 经济效益 环保材料 环境保护,"绿色不仅仅是我国大力倡导的一种理念,也是世界各国普遍认同的。对具有环境友好与健康有益两个核心内涵属性事物的一种形容性、描述性称谓,绿色印刷是指采用环保材料和工艺。印刷过程中产生污染少、节约资源和能源,印刷品废弃后易于回收再利用再循环、可自然降解。对生态环境影响小的印刷方式。不仅体现可持续发展理念、先进科技水平,也是实现节能减排与低碳经济的重要手段。绿色印刷强调在顾及当代人的同时兼顾下一代人的生存发展,它要求印刷企业将近期利益与国家长远利益相结合,环境效益与经济效益相接轨,实现环保事业与市场经济双赢,体现可持续发展理念。在印刷产品的整个生命周期过程中,始终贯穿""以人为本""的宗旨理念,在科学"
PSA 贴敷工艺 误差模型 动态特性 优化算法 运动控制器,柔性印刷电路板具有轻薄柔并易于大规模生产的特点在手机平板电脑等电子产品中得到了广泛应用柔板的自动化生产是提高产量和良品率的重要手段在柔板生产中关键设备如贴片机的自动化程度已很高但PSA贴敷还是以人工作业为主精度差效率低是典型的劳动力密集型生产为此我们研制了一种高精度高速度的PSA贴敷机节省了人力填补了市场空白本文以PSA贴敷机为研究对象针对PSA贴敷生产中高精度高速度的要求分析了PSA贴敷机由结构设计和运动控制引入的各误差项在仿真计算的基础上结合实际测量数据提出了优化设计方案并成功地应用到PSA产品中在分析贴装头的速度曲线时发现速度波动很大这是导致设备精度下降定位时间长的主要因素经过仿真计算发现使用基于全闭环S型曲线速度控制的方法可以满足设备的精度要求通过搭建嵌入式控制平台实现了该算法实测数据表明该算法可以解决设备精度下降和定位时间长的问题为PSA的产品化提供了指导意见在测试嵌入式控制平台时探索了相关的硬件组成和软件架构为将来的推广应用打下了良好的基础全文取得了如下研究成果1建立了PSA贴敷机的几何误差数学模型分析了影响贴敷精度的关键误差元素指出了设计和装配中需要注意的关键环节2对PSA贴敷机进行了模态计算和瞬态动力学仿真分析了影响PSA贴敷机动态特性的各项因素提出了优化设计方案并进行了验证3针对伺服电机高频次短距离定位中的振荡问题设计了全闭环S型曲线速度控制方法并进行了仿真验证为从控制上优化贴敷精度提供了理论基础4为优化设备控制系统和实现速度控制算法设计了以ARMDSP为核心的嵌入式控制平台优化了速度和位置控制曲线并通过该实验台验证了系统的可实施性
柔性电路板 贴敷PSA胶片 自动化设备,"针对当前柔性电路板贴敷PSA(压敏胶)胶片工序自动化程度低的情况,研发了可以完成贴敷PSA工序的全自动化设备,并能够满足柔版生产线速率、适应多种规格的PSA胶片。对该设备的工艺流程、结构特点及达到的技术指标进行了论述。设备的研制极大地提高了生产效率和贴敷精度。"
绿色印刷 发展现状 发展策略,"印刷是重污染行业,绿色印刷是目前行业发展的主流声音。对于西方国家来说,绿色印刷已经有较为成熟的经验,而对我国而言,绿色印刷还是个新兴事物,但近年来这一概念在我国得到了广泛的认可,并取得了飞速的发展。为了让绿色印刷在我国更好的发展,本文将从政府、行业协会、企业角度进行分析,提出针对各主体的、可行的建议。"
绿色印刷;品牌盛会;全印展;印刷杂志;社会传播;环保节能产品;高峰会议;宣传展示;香港印刷业;印刷技术;,"由中国印刷技术协会主办、中国印刷杂志社承办的""绿色印刷技术交流会""是集中向全社会传播绿色低碳理念、宣传展示绿色印刷企业及环保节能产品,推动绿色环保新技术、新材料的应用的行业高峰会议,已成为展示我国绿色印刷最新成果的行业品牌盛会,对于推动绿色印刷发展具有重要的风向意义。在前三届成功举办的基础上,第四届""绿色印刷技术交流会""将于2014年11月1 5日上海全印展期间拉开帷幕。对于这一品牌盛会.每一个曾经参会的嘉宾,他们的眼中会有各自怎样的解读呢?"
绿色印刷 印刷油墨 环保型印版 印刷工艺及设备 印刷人才,"绿色印刷是""十二五""印刷业的主要发展方向,也是印刷企业应承担的社会责任。低碳环保可持续发展的绿色印刷作为生态文明建设的组成部分,将成为未来印刷业转型发展的必然之路。当务之急,需通过印刷工艺的优化、印刷材料设备的创新、印刷人才的培养,不断推广绿色印刷。"
绿色印刷;环境保护标准;环境问题;印刷产业;绿色管理;环境观念;印刷标准;管理构成;绿色标准;深绿色;,"深绿色的环境观念强调的是:探究环境问题产生的经济社会原因,并在此基础上提出解决途径;坚持弘扬环境与发展双赢的积极态度;不再单纯依靠技术层去解决问题,而是从技术到体制,再到文化层面全方位地提出解决办法。绿色印刷在我国推行已历经3年多的时间,绿色印刷实施工作取得了一定成效。全国已有400多家企业获得绿色印刷认证。然而,印刷企业获得绿色印刷认证只是满足国家环境保护标准的第一步,如何持之以恒地走绿色印刷之路,将"
绿色印刷;中小学教科书;书刊印刷企业;印刷工价;印刷行业协会;复制业;产品认证;中国环境标志;申报程序;奖励办法;,"近两年,许多印刷企业乘上绿色印刷的轻轨,率先进入了""后绿色印刷""时代。2012年4月6日,原新闻出版总署、教育部、环保部联合下发了关于中小学教科书实施绿色印刷的通知,其中讲到在1~2年内基本实现全国中小学教科书绿色印刷的全覆盖。现在已经过去了两年多,全国中小学教科书绿色印刷实施进展如何呢?步入""后绿色印刷""时代据有关信息透露,到目前为止全国已有500多家印刷企业通过绿色印刷认证,获得""中国环境"
绿色印刷;商业票据印刷;平版印刷;柔性版印刷;丝网印刷;环境标志;产品技术要求;印刷领域;凹印;环境影响;,"近日,国家环境保护部发布公告,正式发布标准编号为HJ2539-2014的《环境标志产品技术要求印刷第三部分:凹版印刷》,并于2014年12月1日正式实施。这是继""《平版印刷》和《商业票据印刷》标准出台后,我国印刷行业第三部绿色印刷标准正式颁布实施,意味着凹版印刷企业即将开启绿色印刷之旅。绿色印刷标准是实施绿色印刷、评价绿色印刷成果的技术依据,绿色印刷标准由环保部和新闻出版广电总局共同组织制定。根据""我国实施绿色印刷规划""部署,接下来相关部门还将进行""柔性版印刷""、""丝网印刷""、""数字印刷""等绿色印刷标准的制订工作。"
包装印刷 挥发性有机物 排放控制 层次分析法 技术评估,"挥发性有机物(volatile organic compounds,VOCs)是造成我国城市大气污染的主要因素之一,包括包装印刷行业活动等在内的工业源是VOCs污染的重要来源.工业源的治理技术众多,如何选择合适的治理技术是面临的主要问题.本文在包装印刷行业VOCs排放特点及现有治理技术的研究基础上,针对包装印刷行业中典型的复合膜干复工艺VOCs排放与治理,以层次分析法为模型,构建该行业VOCs控制技术评估体系,对包装印刷行业现有治理技术进行综合评估,筛选出最佳可行控制技术,为包装印刷行业VOCs减排控制提供了技术支持.结果表明,包括吸附回收和热力焚烧在内的7种技术,其技术优先顺序为:碳纤维吸脱附颗粒炭吸脱附直接燃烧蓄热燃烧催化燃烧转轮浓缩燃烧活性炭浓缩燃烧,其中碳纤维吸脱附技术综合评估权重较高,为最优控制技术."
绿色印刷;印刷杂志;信息反馈;世界环境日;纪念意义;印刷有限公司;问卷调查;活动主办方;推广阶段;中华商务;,"各位来宾、各位媒体朋友:大家下午好!首先,我代表活动主办方,对各位的光临表示热烈的欢迎和衷心的感谢!今天是""世界环境日"",中国印刷技术协会、中国印刷杂志社正式启动""第二次中国绿色印刷企业调查"",很有纪念意义。去年我们对184家绿色印刷获证企业集中进行了问卷调查,收集到了有关绿色印刷企业的第一手资料,结合企业的信息反馈,全面、及时、准确地了解我国绿色印刷企业生产经营情况和实际需求,为实施绿色印刷和行业主管部门制定相关政策提供了有价值的依据和参考。两部委《关于实施绿色印刷的公告》要求,自2014年开始进入绿色印刷全面推广阶段。公告指出:""2014年至"
CVD 石墨烯薄膜 透明电极 饱和吸收体,石墨烯是由碳原子以sp2杂化轨道组成六角型呈蜂巢状的单原子层的二维晶体石墨烯独特的结构赋予了其超凡的物理性质石墨烯中电子载荷子的性质与相对论性的中微子非常相似其运动速度达到了光速的1300远远超过了电子在一般导体中的运动速度理论上石墨烯的电子迁移率可达到2105cm2Vs使其表现出非凡的导电性石墨烯具有优良的透明度单层石墨烯的透过率在可见红外区可以达到977因此石墨烯是一种良好的透明导电材料可以作为电极应用在透明触控屏幕液晶显示器甚至是太阳能电池等电子器件上除了独特的电子学特性石墨烯还表现出典型的可饱和吸收特性与传统的半导体材料不同石墨烯独特的零带隙结构使其对光的吸收没有选择性适用于工作在各种波长的激光器近几年石墨烯超凡的性能吸引了人们广泛的研究本论文在这些研究的基础上围绕提高石墨烯的透明导电性实现石墨烯的应用展开了一系列工作本文用化学气相沉积CVD方法在铜箔上制备了大面积的石墨烯薄膜设计了双温区结构的CVD系统实现了高品质石墨烯在绝缘石英基片上直接生长并以石墨烯为基础制备了石墨烯扬声器石墨烯生物传感器石墨烯饱和吸收体等器件主要工作如下1设计了一个双温区CVD系统在绝缘的SiO2基片上制备了高品质的石墨烯薄膜石墨烯薄膜的厚度可通过前驱气体的比例流量以及生长时间进行控制拉曼光谱和高分辨透射电子显微镜HRTEM分析表明石墨烯的晶粒尺寸可达到100nm霍尔测量表明室温下石墨烯的载流子浓度为1500cm2Vs石墨烯薄膜的电导性和光透射率可以媲美转移后金属催化的石墨烯本工作避免了石墨烯繁杂的转移过程为石墨烯的制备开辟了一条新的途径2基于石英基片上直接生长的石墨烯我们设计了场效应管FET结构的石墨烯生物传感器用于检测生命体内的能量分子三磷酸腺苷ATP该传感器显示了毫秒级时间分辨率为实时监测生命体动态的生命活动提供了可能此外此传感器测量的范围非常宽在00025mM的浓度范围内其电流的响应与ATP浓度对数呈现了良好的线性关系灵敏度达到50由于00025mM的浓度覆盖了真实生命体内的ATP浓度范围此项工作对研究生命体中动态的生命过程具有现实的意义3将石墨烯作为电极转移在聚偏氟乙烯PVDF压电薄膜的两侧利用PVDF的逆压电效应制备了一种透明可弯曲的薄膜扬声器测试表明该扬声器在几赫兹到几万赫兹极宽频率范围内都可获得较好的音频响应具有高声压级SPL低谐波失真THD和低功耗的特点与传统的商用扬声器相比石墨烯薄膜扬声器无磁透明可弯曲极有希望成为未来超薄超轻的可穿戴的电子器件4将二维石墨烯与一维纳米线复合制备了一种复合透明柔性电极这种复合薄膜的电阻仅为16而透过率却高达911展示了优异的化学稳定性和机械柔韧性这些性质要远远优于商用的ITO和最好的石墨烯电极本工作展示了一种制备低成本高性能柔性透明电极的方法5将石墨烯转移到单晶C面的石英基片上制备了石墨烯饱和吸收体由于生长的为单层石墨烯可通过转移次数精确控制石墨烯的层数使用这些饱和吸收体我们在NdYVO4激光器上实现了稳定的Q锁模在60W的泵浦功率下得到了16W的平均输出功率本工作证实了低成本宽频带的石墨烯饱和吸收体适合于超快高能的脉冲激光
